"Food_Code","Food_Abbrev_Desc","Food_Desc"
72125223.00,"SPINACH,COOKED,FROM CANNED,FAT ADDED","Spinach, cooked, from canned, fat added in cooking"
72125230.00,"SPINACH, NS AS TO FORM, CREAMED","Spinach, NS as to form, creamed"
72125231.00,"SPINACH, FROM FRESH, CREAMED","Spinach, from fresh, creamed"
72125232.00,"SPINACH, FROM FROZEN, CREAMED","Spinach, from frozen, creamed"
72125233.00,"SPINACH, FROM CANNED, CREAMED","Spinach, from canned, creamed"
72125240.00,"SPINACH SOUFFLE","Spinach souffle"
72125250.00,"SPINACH, COOKED, NS AS TO FORM, W/ CHEESE SAUCE","Spinach, cooked, NS as to form, with cheese sauce"
72125251.00,"SPINACH, COOKED, FROM FRESH, W/ CHEESE SAUCE","Spinach, cooked, from fresh, with cheese sauce"
72125252.00,"SPINACH, COOKED, FROM FROZEN, W/ CHEESE SAUCE","Spinach, cooked, from frozen, with cheese sauce"
72125253.00,"SPINACH, COOKED, FROM CANNED, W/ CHEESE SAUCE","Spinach, cooked, from canned, with cheese sauce"
72125260.00,"SPINACH & CHEESE CASSEROLE","Spinach and cheese casserole"
72125500.00,"SPINACH & CHICK PEAS, FAT ADDED","Spinach and chickpeas, fat added"
72126000.00,"TARO LEAVES, COOKED, FAT NOT ADDED IN COOKING","Taro leaves, cooked, fat not added in cooking"
72128200.00,"TURNIP GREENS, COOKED, NS FORM, NS AS TO ADDED FAT","Turnip greens, cooked, NS as to form, NS as to fat added in cooking"
72128201.00,"TURNIP GREENS,COOKED,FROM FRESH,NS FAT ADDED","Turnip greens, cooked, from fresh, NS as to fat added in cooking"
72128202.00,"TURNIP GREENS,COOKED,FROM FROZEN,NS FAT ADDED","Turnip greens, cooked, from frozen, NS as to fat added in cooking"
72128203.00,"TURNIP GREENS,COOKED,FROM CANNED,NS FAT ADDED","Turnip greens, cooked, from canned, NS as to fat added in cooking"
72128210.00,"TURNIP GREENS, NS FORM, COOKED, FAT NOT ADDED","Turnip greens, cooked, NS as to form, fat not added in cooking"
72128211.00,"TURNIP GREENS,COOKED,FROM FRESH,FAT NOT ADDED","Turnip greens, cooked, from fresh, fat not added in cooking"
72128212.00,"TURNIP GREENS,COOKED,FROM FROZEN,FAT NOT ADDED","Turnip greens, cooked, from frozen, fat not added in cooking"
72128213.00,"TURNIP GREENS,COOKED,FROM CANNED,FAT NOT ADDED","Turnip greens, cooked, from canned, fat not added in cooking"
72128220.00,"TURNIP GREENS, COOKED, NS FORM, FAT ADDED","Turnip greens, cooked, NS as to form, fat added in cooking"
72128221.00,"TURNIP GREENS,COOKED,FROM FRESH,FAT ADDED","Turnip greens, cooked, from fresh, fat added in cooking"
72128222.00,"TURNIP GREENS,COOKED,FROM FROZEN,FAT ADDED","Turnip greens, cooked, from frozen, fat added in cooking"
72128223.00,"TURNIP GREENS,COOKED,FROM CANNED,FAT ADDED","Turnip greens, cooked, from canned, fat added in cooking"
72128410.00,"TURNIP GREENS W/ ROOTS, CKD, NS FORM, FAT NOT ADDED","Turnip greens with roots, cooked, NS as to form, fat not added in cooking"
72128411.00,"TURNIP GREENS W/ ROOTS, CKD, FROM FRESH, NO FAT ADDED","Turnip greens with roots, cooked, from fresh, fat not added in cooking"
72128412.00,"TURNIP GREENS W/ ROOTS, CKD, FROM FROZ, NO FAT ADDED","Turnip greens with roots, cooked, from frozen, fat not added in cooking"
72128421.00,"TURNIP GREENS W/ ROOTS, CKD, FROM FRESH, FAT ADDED","Turnip greens with roots, cooked, from fresh, fat added in cooking"
72128510.00,"TURNIP GREENS, CANNED, LOW SODIUM, FAT NOT ADDED","Turnip greens, canned, low sodium, cooked, fat not added in cooking"
72128520.00,"TURNIP GREENS, CANNED, LOW SODIUM, FAT ADDED","Turnip greens, canned, low sodium, cooked, fat added in cooking"
72130100.00,"WATERCRESS, RAW","Watercress, raw"
72130200.00,"WATERCRESS, COOKED, FAT NOT ADDED IN COOKING","Watercress, cooked, fat not added in cooking"
72132200.00,"BITTERMELON,HORSERADISH,JUTE,RADISH LVES,CKD,NO FAT","Bitter melon leaves, horseradish leaves, jute leaves, or radish leaves, cooked, fat not added in cooking"
72133200.00,"SWEETPOTATO,SQUASH,PUMPKIN LEAVES,CKD,FAT NOT ADDED","Sweetpotato leaves, squash leaves, pumpkin leaves, chrysanthemum leaves, bean leaves, or swamp cabbage, cooked, fat not added in cooking"
72201100.00,"BROCCOLI, RAW","Broccoli, raw"
72201200.00,"BROCCOLI, CKD, NS FORM, NS FAT (INCL BROCCOLI, NFS)","Broccoli, cooked, NS as to form, NS as to fat added in cooking"
72201201.00,"BROCCOLI, CKD, FROM FRESH, NS FAT (INCL BROCCOLI, NFS)","Broccoli, cooked, from fresh, NS as to fat added in cooking"
72201202.00,"BROCCOLI, CKD, FROM FROZ, NS FAT (INCL BROCCOLI, NFS)","Broccoli, cooked, from frozen, NS as to fat added in cooking"
72201210.00,"BROCCOLI, COOKED, NS AS TO FORM, NO FAT ADDED","Broccoli, cooked, NS as to form, fat not added in cooking"
72201211.00,"BROCCOLI, COOKED, FROM FRESH, NO FAT ADDED","Broccoli, cooked, from fresh, fat not added in cooking"
72201212.00,"BROCCOLI, COOKED, FROM FROZ, NO FAT ADDED","Broccoli, cooked, from frozen, fat not added in cooking"
72201220.00,"BROCCOLI, COOKED, NS AS TO FORM, FAT ADDED","Broccoli, cooked, NS as to form, fat added in cooking"
72201221.00,"BROCCOLI, COOKED, FROM FRESH, FAT ADDED","Broccoli, cooked, from fresh, fat added in cooking"
72201222.00,"BROCCOLI, COOKED, FROM FROZ, FAT ADDED","Broccoli, cooked, from frozen, fat added in cooking"
72201230.00,"BROCCOLI, COOKED, NS AS TO FORM, W/ CHEESE SAUCE","Broccoli, cooked, NS as to form, with cheese sauce"
72201231.00,"BROCCOLI, COOKED, FROM FRESH, W/ CHEESE SAUCE","Broccoli, cooked, from fresh, with cheese sauce"
72201232.00,"BROCCOLI, COOKED, FROM FROZEN, W/ CHEESE SAUCE","Broccoli, cooked, from frozen, with cheese sauce"
72201240.00,"BROCCOLI, COOKED, NS AS TO FORM, W/ MUSHROOM SAUCE","Broccoli, cooked, NS as to form, with mushroom sauce"
72201241.00,"BROCCOLI, COOKED, FROM FRESH, W/ MUSHROOM SAUCE","Broccoli, cooked, from fresh, with mushroom sauce"
72201242.00,"BROCCOLI, COOKED, FROM FROZEN, W/ MUSHROOM SAUCE","Broccoli, cooked, from frozen, with mushroom sauce"
72201250.00,"BROCCOLI, COOKED, NS AS TO FORM, W/ CREAM SAUCE","Broccoli, cooked, NS as to form, with cream sauce"
72201251.00,"BROCCOLI, COOKED, FROM FRESH, W/ CREAM SAUCE","Broccoli, cooked, from fresh, with cream sauce"
72201252.00,"BROCCOLI, COOKED, FROM FROZEN, W/ CREAM SAUCE","Broccoli, cooked, from frozen, with cream sauce"
72202010.00,"BROCCOLI CASSEROLE (BROC, NOODLES, CREAM SAUCE)","Broccoli casserole (broccoli, noodles, and cream sauce)"
72202020.00,"BROCCOLI CASSEROLE (BROC,RICE,CHEESE,MUSHROOM SCE)","Broccoli casserole (broccoli, rice, cheese, and mushroom sauce)"
72202030.00,"BROCCOLI, BATTER-DIPPED & FRIED","Broccoli, batter-dipped and fried"
72302000.00,"BROCCOLI SOUP (INCLUDE CREAM OF BROCCOLI SOUP)","Broccoli soup"
72302100.00,"BROCCOLI CHEESE SOUP, PREP W/ MILK","Broccoli cheese soup, prepared with milk"
72305000.00,"ESCAROLE SOUP","Escarole soup"
72307000.00,"SPINACH SOUP","Spinach soup"
72308000.00,"DARK-GREEN LEAFY VEGETABLE SOUP,W/MEAT,ORIENTAL","Dark-green leafy vegetable soup with meat, Oriental style"
72308500.00,"DARK-GREEN LEAFY VEGETABLE SOUP,MEATLESS,ORIENTAL","Dark-green leafy vegetable soup, meatless, Oriental style"
73101010.00,"CARROTS, RAW","Carrots, raw"
73101110.00,"CARROTS, RAW, SALAD (INCLUDE CARROT-RAISIN SALAD)","Carrots, raw, salad"
73101210.00,"CARROTS, RAW, SALAD W/ APPLES","Carrots, raw, salad with apples"
73102200.00,"CARROTS, COOKED, NS AS TO FORM, NS FAT ADDED","Carrots, cooked, NS as to form, NS as to fat added in cooking"
73102201.00,"CARROTS, COOKED, FROM FRESH, NS FAT ADDED","Carrots, cooked, from fresh, NS as to fat added in cooking"
73102202.00,"CARROTS, COOKED, FROM FROZEN, NS FAT ADDED","Carrots, cooked, from frozen, NS as to fat added in cooking"
73102203.00,"CARROTS, COOKED, FROM CANNED, NS FAT ADDED","Carrots, cooked, from canned, NS as to fat added in cooking"
73102210.00,"CARROTS, COOKED, NS AS TO FORM, FAT NOT ADDED","Carrots, cooked, NS as to form, fat not added in cooking"
73102211.00,"CARROTS, COOKED, FROM FRESH, FAT NOT ADDED","Carrots, cooked, from fresh, fat not added in cooking"
73102212.00,"CARROTS, COOKED, FROM FROZEN, FAT NOT ADDED","Carrots, cooked, from frozen, fat not added in cooking"
73102213.00,"CARROTS, COOKED, FROM CANNED, FAT NOT ADDED","Carrots, cooked, from canned, fat not added in cooking"
73102220.00,"CARROTS, COOKED, NS AS TO FORM, FAT ADDED","Carrots, cooked, NS as to form, fat added in cooking"
73102221.00,"CARROTS, COOKED, FROM FRESH, FAT ADDED","Carrots, cooked, from fresh, fat added in cooking"
73102222.00,"CARROTS, COOKED, FROM FROZEN, FAT ADDED","Carrots, cooked, from frozen, fat added in cooking"
73102223.00,"CARROTS, COOKED, FROM CANNED, FAT ADDED","Carrots, cooked, from canned, fat added in cooking"
73102230.00,"CARROTS, COOKED, NS AS TO FORM, CREAMED","Carrots, cooked, NS as to form, creamed"
73102231.00,"CARROTS, COOKED, FROM FRESH, CREAMED","Carrots, cooked, from fresh, creamed"
73102233.00,"CARROTS, COOKED, FROM CANNED, CREAMED","Carrots, cooked, from canned, creamed"
73102240.00,"CARROTS, COOKED, NS AS TO FORM, GLAZED","Carrots, cooked, NS as to form, glazed"
73102241.00,"CARROTS, COOKED, FROM FRESH, GLAZED","Carrots, cooked, from fresh, glazed"
73102242.00,"CARROTS, COOKED, FROM FROZEN, GLAZED","Carrots, cooked, from frozen, glazed"
73102243.00,"CARROTS, COOKED, FROM CANNED, GLAZED","Carrots, cooked, from canned, glazed"
73102251.00,"CARROTS, COOKED, FROM FRESH, W/ CHEESE SAUCE","Carrots, cooked, from fresh, with cheese sauce"
73102252.00,"CARROTS, COOKED, FROM FROZEN, W/ CHEESE SAUCE","Carrots, cooked, from frozen, with cheese sauce"
73103010.00,"CARROTS, CANNED, LOW SODIUM, NO FAT ADDED","Carrots, canned, low sodium, fat not added in cooking"
73103020.00,"CARROTS, CANNED, LOW SODIUM, FAT ADDED","Carrots, canned, low sodium, fat added in cooking"
73105010.00,"CARROT JUICE","Carrot juice"
73111030.00,"PEAS & CARROTS, NS AS TO FORM, CREAMED","Peas and carrots, NS as to form, creamed"
73111032.00,"PEAS & CARROTS, FROM FROZEN, CREAMED","Peas and carrots, from frozen, creamed"
73111033.00,"PEAS & CARROTS, FROM CANNED, CREAMED","Peas and carrots, from canned, creamed"
73111200.00,"PEAS & CARROTS, COOKED, NS FORM, NS AS TO ADDED FAT","Peas and carrots, cooked, NS as to form, NS as to fat added in cooking"
73111201.00,"PEAS & CARROTS, COOKED, FROM FRESH, NS FAT ADDED","Peas and carrots, cooked, from fresh, NS as to fat added in cooking"
73111202.00,"PEAS & CARROTS, COOKED, FROM FROZ, NS FAT ADDED","Peas and carrots, cooked, from frozen, NS as to fat added in cooking"
73111203.00,"PEAS & CARROTS, COOKED, FROM CANNED, NS FAT ADDED","Peas and carrots, cooked, from canned, NS as to fat added in cooking"
73111210.00,"PEAS & CARROTS, COOKED, NS FORM, FAT NOT ADDED","Peas and carrots, cooked, NS as to form, fat not added in cooking"
73111211.00,"PEAS & CARROTS, COOKED, FROM FRESH, FAT NOT ADDED","Peas and carrots, cooked, from fresh, fat not added in cooking"
73111212.00,"PEAS & CARROTS, COOKED, FROM FROZ, FAT NOT ADDED","Peas and carrots, cooked, from frozen, fat not added in cooking"
73111213.00,"PEAS & CARROTS, COOKED, FROM CANNED, FAT NOT ADDED","Peas and carrots, cooked, from canned, fat not added in cooking"
73111220.00,"PEAS & CARROTS, COOKED, NS AS TO FORM, FAT ADDED","Peas and carrots, cooked, NS as to form, fat added in cooking"
73111221.00,"PEAS & CARROTS, COOKED, FROM FRESH, FAT ADDED","Peas and carrots, cooked, from fresh, fat added in cooking"
73111222.00,"PEAS & CARROTS, COOKED, FROM FROZ, FAT ADDED","Peas and carrots, cooked, from frozen, fat added in cooking"
73111223.00,"PEAS & CARROTS, COOKED, FROM CANNED, FAT ADDED","Peas and carrots, cooked, from canned, fat added in cooking"
73111270.00,"PEAS & CARROTS, CANNED, LOW SODIUM, NO FAT ADDED","Peas and carrots, canned, low sodium, fat not added in cooking"
73111400.00,"CARROTS IN TOMATO SAUCE","Carrots in tomato sauce"
73112000.00,"CARROT CHIPS, DRIED","Carrot chips, dried"
73201000.00,"PUMPKIN, COOKED, NS AS TO FORM, NS AS TO ADDED FAT","Pumpkin, cooked, NS as to form, NS as to fat added in cooking"
73201001.00,"PUMPKIN, COOKED, FROM FRESH, NS AS TO ADDED FAT","Pumpkin, cooked, from fresh, NS as to fat added in cooking"
73201010.00,"PUMPKIN, COOKED, NS AS TO FORM, FAT NOT ADDED","Pumpkin, cooked, NS as to form, fat not added in cooking"
73201011.00,"PUMPKIN, COOKED, FROM FRESH, FAT NOT ADDED","Pumpkin, cooked, from fresh, fat not added in cooking"
73201012.00,"PUMPKIN, COOKED, FROM FROZEN, FAT NOT ADDED","Pumpkin, cooked, from frozen, fat not added in cooking"
73201013.00,"PUMPKIN, COOKED, FROM CANNED, FAT NOT ADDED","Pumpkin, cooked, from canned, fat not added in cooking"
73201020.00,"PUMPKIN, COOKED, NS AS TO FORM, FAT ADDED","Pumpkin, cooked, NS as to form, fat added in cooking"
73201021.00,"PUMPKIN, COOKED, FROM FRESH, FAT ADDED","Pumpkin, cooked, from fresh, fat added in cooking"
73210010.00,"CALABAZA (SPANISH PUMPKIN), COOKED","Calabaza (Spanish pumpkin), cooked"
73210110.00,"PUMPKIN FRITTERS, P.R.","Pumpkin fritters, Puerto Rican style"
73301000.00,"SQUASH, WINTER, MASHED, NS AS TO ADDED FAT/SUGAR","Squash, winter type, mashed, NS as to fat or sugar added in cooking"
73301010.00,"SQUASH, WINTER, MASHED, NO FAT OR SUGAR ADDED","Squash, winter type, mashed, no fat or sugar added in cooking"
73301020.00,"SQUASH, WINTER, COOKED, MASHED, FAT ADDED, NO SUGAR","Squash, winter type, mashed, fat added in cooking, no sugar added in cooking"
73301030.00,"SQUASH, WINTER, COOKED, MASHED, FAT & SUGAR ADDED","Squash, winter type, mashed, fat and sugar added in cooking"
73303000.00,"SQUASH, WINTER, BAKED, NS FAT OR SUGAR ADDED","Squash, winter type, baked, NS as to fat or sugar added in cooking"
73303010.00,"SQUASH, WINTER, BAKED, NO FAT OR SUGAR ADDED","Squash, winter type, baked, no fat or sugar added in cooking"
73303020.00,"SQUASH, WINTER, BAKED, FAT ADDED, NO SUGAR","Squash, winter type, baked, fat added in cooking, no sugar added in cooking"
73303030.00,"SQUASH, WINTER, BAKED, FAT & SUGAR ADDED","Squash, winter type, baked, fat and sugar added in cooking"
73303040.00,"SQUASH, WINTER, BAKED, NO ADDED FAT, SUGAR ADDED","Squash, winter type, baked, no fat added in cooking, sugar added in cooking"
73305010.00,"SQUASH, WINTER, BAKED W/ CHEESE","Squash, winter, baked with cheese"
73305020.00,"SQUASH, WINTER, SOUFFLE","Squash, winter, souffle"
73401000.00,"SWEETPOTATO, NFS","Sweetpotato, NFS"
73402000.00,"SWEETPOTATO, BAKED, PEEL EATEN, NS AS TO ADDED FAT","Sweetpotato, baked, peel eaten, NS as to fat added in cooking"
73402010.00,"SWEETPOTATO, BAKED, PEEL EATEN, NO FAT ADDED","Sweetpotato, baked, peel eaten, fat not added in cooking"
73402020.00,"SWEETPOTATO, BAKED, PEEL EATEN, FAT ADDED","Sweetpotato, baked, peel eaten, fat added in cooking"
73403000.00,"SWEETPOTATO, BAKED, PEEL NOT EATEN, NS AS TO FAT","Sweetpotato, baked, peel not eaten, NS as to fat added in cooking"
73403010.00,"SWEETPOTATO, BAKED, PEEL NOT EATEN, FAT NOT ADDED","Sweetpotato, baked, peel not eaten, fat not added in cooking"
73403020.00,"SWEETPOTATO, BAKED, PEEL NOT EATEN, FAT ADDED","Sweetpotato, baked, peel not eaten, fat added in cooking"
73405000.00,"SWEETPOTATO, BOILED, W/O PEEL, NS AS TO ADDED FAT","Sweetpotato, boiled, without peel, NS as to fat added in cooking"
73405010.00,"SWEETPOTATO, BOILED, W/O PEEL, FAT NOT ADDED","Sweetpotato, boiled, without peel, fat not added in cooking"
73405020.00,"SWEETPOTATO, BOILED, W/O PEEL, FAT ADDED","Sweetpotato, boiled, without peel, fat added in cooking"
73405110.00,"SWEETPOTATO, BOILED W/ PEEL, PEEL NOT EATEN, FAT NOT ADDED","Sweetpotato, boiled with peel, peel not eaten, fat not added in cooking"
73405120.00,"SWEETPOTATO, BOILED W/ PEEL, PEEL NOT EATEN, FAT ADDED","Sweetpotato, boiled with peel, peel not eaten, fat added in cooking"
73406000.00,"SWEETPOTATO, CANDIED","Sweetpotato, candied"
73406010.00,"SWEETPOTATO W/ FRUIT","Sweetpotato with fruit"
73407000.00,"SWEETPOTATO, CANNED, NS AS TO SYRUP","Sweetpotato, canned, NS as to syrup"
73407010.00,"SWEETPOTATO, CANNED, W/O SYRUP","Sweetpotato, canned without syrup"
73407020.00,"SWEETPOTATO, CANNED IN SYRUP","Sweetpotato, canned in syrup"
73407030.00,"SWEETPOTATO, CANNED IN SYRUP, W/ FAT ADDED","Sweetpotato, canned in syrup, with fat added in cooking"
73409000.00,"SWEETPOTATO, CASSEROLE OR MASHED","Sweetpotato, casserole or mashed"
73410110.00,"SWEETPOTATO, FRIED","Sweetpotato, fried"
73410210.00,"SWEET POTATO, CHIPS","Sweet potato, chips"
73501000.00,"CARROT SOUP, CREAM OF, W/ MILK","Carrot soup, cream of, prepared with milk"
73501010.00,"CARROT W/ RICE SOUP, CREAM OF, W/ MILK","Carrot with rice soup, cream of, prepared with milk"
74101000.00,"TOMATOES, RAW","Tomatoes, raw"
74102000.00,"TOMATOES, GREEN, RAW","Tomatoes, green, raw"
74201000.00,"TOMATOES, COOKED, NS AS TO FORM, NS AS TO METHOD","Tomatoes, cooked, NS as to form, NS as to method"
74201001.00,"TOMATOES, COOKED, FROM FRESH, NS AS TO METHOD","Tomatoes, cooked, from fresh, NS as to method"
74201003.00,"TOMATOES, COOKED, FROM CANNED, NS AS TO METHOD","Tomatoes, cooked, from canned, NS as to method"
74202010.00,"TOMATOES, NS AS TO FORM, BROILED","Tomatoes, NS as to form, broiled"
74202011.00,"TOMATOES, FROM FRESH, BROILED","Tomatoes, from fresh, broiled"
74202050.00,"TOMATOES, RED, NS AS TO FORM, FRIED","Tomatoes, red, NS as to form, fried"
74202051.00,"TOMATOES, RED, FROM FRESH, FRIED","Tomatoes, red, from fresh, fried"
74203010.00,"TOMATOES, NS AS TO FORM, SCALLOPED","Tomatoes, NS as to form, scalloped"
74204010.00,"TOMATOES, NS AS TO FORM, STEWED","Tomatoes, NS as to form, stewed"
74204011.00,"TOMATOES, FROM FRESH, STEWED","Tomatoes, from fresh, stewed"
74204013.00,"TOMATOES, FROM CANNED, STEWED","Tomatoes, from canned, stewed"
74204500.00,"TOMATOES, CANNED, LOW SODIUM","Tomatoes, canned, low sodium"
74205010.00,"TOMATOES, GREEN, COOKED, NS AS TO FORM (INCL FRIED)","Tomatoes, green, cooked, NS as to form"
74205011.00,"TOMATOES, GREEN, COOKED, FROM FRESH (INCL FRIED)","Tomatoes, green, cooked, from fresh"
74205020.00,"TOMATOES, GREEN, PICKLED","Tomato, green, pickled"
74206000.00,"TOMATOES, RED, DRIED","Tomatoes, red, dried"
74301100.00,"TOMATO JUICE","Tomato juice"
74301150.00,"TOMATO JUICE, LOW SODIUM","Tomato juice, low sodium"
74302000.00,"TOMATO JUICE COCKTAIL","Tomato juice cocktail"
74303000.00,"TOMATO & VEGETABLE JUICE, MOSTLY TOMATO (INCL V-8)","Tomato and vegetable juice, mostly tomato"
74303100.00,"TOMATO & VEGETABLE JUICE, MOSTLY TOMATO, LOW SODIUM","Tomato and vegetable juice, mostly tomato, low sodium"
74304000.00,"TOMATO JUICE W/ CLAM OR BEEF JUICE","Tomato juice with clam or beef juice"
74401010.00,"TOMATO CATSUP","Tomato catsup"
74401110.00,"TOMATO CATSUP, LOW SODIUM","Tomato catsup, low sodium"
74402010.00,"TOMATO CHILI SAUCE (CATSUP TYPE)","Tomato chili sauce (catsup-type)"
74402100.00,"SALSA, NFS","Salsa, NFS"
74402110.00,"SALSA, RED, UNCOOKED (INCL PICO DE GALLO)","Salsa, red, uncooked"
74402150.00,"SALSA, RED, CKD, NOT HOM (INCL TACO, CREOLE, PICANTE SAUCES)","Salsa, red, cooked, not homemade"
74402200.00,"SALSA, RED, COOKED, HOMEMADE (INCL DE CHILE ROJO)","Salsa, red, cooked, homemade"
74402250.00,"ENCHILADA SAUCE, RED","Enchilada sauce, red"
74402260.00,"ENCHILADA SAUCE, GREEN","Enchilada sauce, green"
74402300.00,"SALSA MADE WITH FRUIT","Salsa made with fruit"
74402310.00,"GREEN TOMATO-CHILE SAUCE, RAW","Green tomato-chile sauce, raw (Salsa de tomate verde cruda)"
74402350.00,"GREEN TOMATO-CHILE SAUCE, COOKED","Green tomato-chile sauce, cooked (Salsa verde, NFS)"
74403010.00,"TOMATO SAUCE","Tomato sauce"
74403050.00,"TOMATO SAUCE, LOW SODIUM","Tomato sauce, low sodium"
74403110.00,"TOMATO PASTE","Tomato paste"
74403120.00,"TOMATO PUREE","Tomato puree"
74404010.00,"SPAGHETTI SAUCE, MEATLESS","Spaghetti sauce, meatless"
74404020.00,"SPAGHETTI SAUCE W/ VEGETABLES, HOMEMADE-STYLE","Spaghetti sauce with vegetables, homemade-style"
74404030.00,"SPAGHETTI SAUCE W/ MEAT, CANNED, NO EXTRA MEAT","Spaghetti sauce with meat, canned, no extra meat added"
74404050.00,"SPAGHETTI SAUCE, MEATLESS, LOW SODIUM","Spaghetti sauce, meatless, low sodium"
74404060.00,"SPAGHETTI SAUCE, MEATLESS, FAT FREE","Spaghetti sauce, meatless, fat free"
74405010.00,"TOMATO RELISH (INCLUDE TOMATO PRESERVES)","Tomato relish"
74406010.00,"BARBECUE SAUCE","Barbecue sauce"
74406050.00,"BARBECUE SAUCE, LOW SODIUM","Barbecue sauce, low sodium"
74406100.00,"STEAK SAUCE, TOMATO-BASE (INCLUDE A-1)","Steak sauce, tomato-base"
74406500.00,"COCKTAIL SAUCE","Cocktail sauce"
74410110.00,"PUERTO RICAN SEASONING WITH HAM","Puerto Rican seasoning with ham"
74415110.00,"PUERTO RICAN SEASONING W/ HAM & TOMATO SAUCE","Puerto Rican seasoning with ham and tomato sauce"
74501010.00,"TOMATO ASPIC","Tomato aspic"
74502010.00,"TOMATO & LIMA BEANS,COOKED,FAT NOT ADDED IN COOKING","Tomato and lima beans, cooked, fat not added cooking"
74503010.00,"TOMATO & CORN, COOKED, FAT NOT ADDED IN COOKING","Tomato and corn, cooked, fat not added in cooking"
74504000.00,"TOMATO & OKRA, COOKED, NS AS TO ADDED FAT","Tomato and okra, cooked, NS as to fat added in cooking"
74504010.00,"TOMATO & OKRA, COOKED, NO FAT ADDED","Tomato and okra, cooked, fat not added in cooking"
74504020.00,"TOMATO & OKRA, COOKED, FAT ADDED","Tomato and okra, cooked, fat added in cooking"
74504100.00,"TOMATO & ONION, COOKED, NS FAT ADDED","Tomato and onion, cooked, NS as to fat added in cooking"
74504110.00,"TOMATO & ONION, COOKED, FAT NOT ADDED IN COOKING","Tomato and onion, cooked, fat not added in cooking"
74504120.00,"TOMATO & ONION, COOKED, FAT ADDED","Tomato and onion, cooked, fat added in cooking"
74504150.00,"TOMATO & CELERY, COOKED, FAT NOT ADDED IN COOKING","Tomato and celery, cooked, fat not added in cooking"
74505000.00,"TOMATO W/ CORN & OKRA, COOKED, NS AS TO ADDED FAT","Tomato with corn and okra, cooked, NS as to fat added in cooking"
74505010.00,"TOMATO W/ CORN & OKRA, COOKED, NO FAT ADDED","Tomato with corn and okra, cooked, fat not added in cooking"
74505020.00,"TOMATO W/ CORN & OKRA, COOKED, FAT ADDED","Tomato with corn and okra, cooked, fat added in cooking"
74506000.00,"TOMATO & CUCUMBER SALAD W/ OIL & VINEGAR","Tomato and cucumber salad made with tomato, cucumber, oil, and vinegar"
74601000.00,"TOMATO SOUP, NFS","Tomato soup, NFS"
74601010.00,"TOMATO SOUP, CREAM OF,PREP W/ MILK","Tomato soup, cream of, prepared with milk"
74602010.00,"TOMATO SOUP, PREPARED W/ WATER","Tomato soup, prepared with water"
74602030.00,"TOMATO SOUP, CANNED, UNDILUTED","Tomato soup, canned, undiluted"
74602050.00,"TOMATO SOUP, INSTANT TYPE, PREPARED W/ WATER","Tomato soup, instant type, prepared with water"
74602100.00,"TOMATO SOUP, CANNED, LOW SODIUM, READY-TO-SERVE","Tomato soup, canned, low sodium, ready-to-serve"
74602200.00,"TOMATO SOUP, CANNED, REDUCED SODIUM, PREP W/ WATER","Tomato soup, canned, reduced sodium, prepared with water"
74602300.00,"TOMATO SOUP, CANNED, REDUCED SODIUM, PREP W/ MILK","Tomato soup, canned, reduced sodium, prepared with milk"
74603010.00,"TOMATO BEEF SOUP, PREPARED W/ WATER","Tomato beef soup, prepared with water"
74604010.00,"TOMATO BEEF NOODLE SOUP, PREPARED W/ WATER","Tomato beef noodle soup, prepared with water"
74604100.00,"TOMATO BEEF RICE SOUP, PREPARED W/ WATER","Tomato beef rice soup, prepared with water"
74604500.00,"TOMATO NOODLE SOUP, PREPARED W/ WATER","Tomato noodle soup, prepared with water"
74604600.00,"TOMATO NOODLE SOUP, CREAM OF","Tomato noodle soup, cream of"
74605010.00,"TOMATO RICE SOUP, PREPARED W/ WATER","Tomato rice soup, prepared with water"
74606010.00,"TOMATO VEGETABLE SOUP, PREP W/ WATER","Tomato vegetable soup, prepared with water"
74606020.00,"TOMATO VEGETABLE SOUP W/NOODLES, PREPARED W/ WATER","Tomato vegetable soup with noodles, prepared with water"
74701000.00,"TOMATO SANDWICH","Tomato sandwich"
75100250.00,"RAW VEGETABLE, NFS","Raw vegetable, NFS"
75100300.00,"SPROUTS, NFS","Sprouts, NFS"
75100500.00,"ALFALFA SPROUTS, RAW","Alfalfa sprouts, raw"
75100750.00,"ARTICHOKE, JERUSALEM, RAW (INCLUDE SUNCHOKE)","Artichoke, Jerusalem, raw"
75100800.00,"ASPARAGUS, RAW","Asparagus, raw"
75101000.00,"BEAN SPROUTS, RAW (SOYBEAN/MUNG)","Bean sprouts, raw (soybean or mung)"
75101800.00,"BEANS, STRING, GREEN, RAW","Beans, string, green, raw"
75102000.00,"BEANS, LIMA, RAW","Beans, lima, raw"
75102500.00,"BEETS, RAW","Beets, raw"
75102750.00,"BRUSSELS SPROUTS, RAW","Brussels sprouts, raw"
75103000.00,"CABBAGE, GREEN, RAW","Cabbage, green, raw"
75104000.00,"CABBAGE, CHINESE, RAW","Cabbage, Chinese, raw"
75105000.00,"CABBAGE, RED, RAW","Cabbage, red, raw"
75105500.00,"CACTUS, RAW","Cactus, raw"
75107000.00,"CAULIFLOWER, RAW","Cauliflower, raw"
75109000.00,"CELERY, RAW (INCLUDE CELERY, NFS)","Celery, raw"
75109500.00,"CHIVES, RAW (INCLUDE CHIVES, NFS)","Chives, raw"
75109550.00,"CILANTRO, RAW","Cilantro, raw"
75109600.00,"CORN, RAW","Corn, raw"
75111000.00,"CUCUMBER, RAW (INCLUDE CUCUMBER, NFS)","Cucumber, raw"
75111200.00,"EGGPLANT, RAW","Eggplant, raw"
75111500.00,"GARLIC, RAW","Garlic, raw"
75111800.00,"JICAMA, RAW (INCLUDE YAMBEAN)","Jicama, raw"
75112000.00,"KOHLRABI, RAW","Kohlrabi, raw"
75112500.00,"LEEK, RAW","Leek, raw"
75113000.00,"LETTUCE, RAW","Lettuce, raw"
75113060.00,"LETTUCE, BOSTON, RAW","Lettuce, Boston, raw"
75113080.00,"LETTUCE, ARUGULA, RAW","Lettuce, arugula, raw"
75114000.00,"MIXED SALAD GREENS, RAW","Mixed salad greens, raw"
75115000.00,"MUSHROOMS, RAW","Mushrooms, raw"
75117010.00,"ONIONS, YOUNG GREEN, RAW","Onions, young green, raw"
75117020.00,"ONIONS, MATURE, RAW","Onions, mature, raw"
75119000.00,"PARSLEY, RAW","Parsley, raw"
75120000.00,"PEAS, GREEN, RAW","Peas, green, raw"
75121000.00,"PEPPER, HOT CHILI, RAW (INCLUDE JALAPENO)","Pepper, hot chili, raw"
75121400.00,"PEPPER, POBLANO, RAW","Pepper, poblano, raw"
75121500.00,"PEPPER, SERRANO, RAW","Pepper, Serrano, raw"
75122000.00,"PEPPER, RAW, NFS","Pepper, raw, NFS"
75122100.00,"PEPPER, SWEET, GREEN, RAW","Pepper, sweet, green, raw"
75122200.00,"PEPPER, SWEET, RED, RAW","Pepper, sweet, red, raw"
75124000.00,"PEPPER, BANANA, RAW","Pepper, banana, raw"
75125000.00,"RADISH, RAW","Radish, raw"
75127500.00,"SEAWEED, RAW (INCLUDE BLANCHED)","Seaweed, raw"
