"Food_Code","Food_Abbrev_Desc","Food_Desc"
27113000.00,"BEEF W/ CREAM OR WHITE SAUCE (MIXTURE)","Beef with cream or white sauce (mixture)"
27113100.00,"BEEF STROGANOFF","Beef stroganoff"
27113200.00,"CREAMED CHIPPED OR DRIED BEEF","Creamed chipped or dried beef"
27113300.00,"SWEDISH MEATBALLS W/ CREAM OR WHITE SAUCE (MIXTURE)","Swedish meatballs with cream or white sauce (mixture)"
27114000.00,"BEEF W/ (MUSHROOM) SOUP (MIXTURE)","Beef with (mushroom) soup (mixture)"
27115000.00,"BEEF W/ SOY-BASED SAUCE (MIXTURE)","Beef with soy-based sauce (mixture)"
27115100.00,"STEAK TERIYAKI W/ SAUCE (MIXTURE)","Steak teriyaki with sauce (mixture)"
27116100.00,"BEEF CURRY","Beef curry"
27116200.00,"BEEF W/ BARBECUE SAUCE (MIXTURE)","Beef with barbecue sauce (mixture)"
27116300.00,"BEEF W/ SWEET & SOUR SAUCE (MIXTURE)","Beef with sweet and sour sauce (mixture)"
27116350.00,"STEWED, SEASONED GROUND BEEF, MEXICAN","Stewed, seasoned, ground beef, Mexican style (Picadillo de carne de rez)"
27116400.00,"STEAK TARTARE (RAW GROUND BEEF & EGG)","Steak tartare (raw ground beef and egg)"
27118110.00,"MEATBALLS, P. R. (ALBONDIGAS GUISADAS)","Meatballs, Puerto Rican style (Albondigas guisadas)"
27118120.00,"STEWED,SEASONED GROUND BEEF,PUERTO RICAN STYLE","Stewed seasoned ground beef, Puerto Rican style (Picadillo guisado, picadillo de carne)"
27118130.00,"STEWED DRIED BEEF, P.R. (TASAJO GUISADO)","Stewed dried beef, Puerto Rican style (Tasajo guisado, carne cecina guisada)"
27118180.00,"BEEF STEW, P.R., MEAT W/ GRAVY (POTATO SEPARATE)","Puerto Rican style beef stew, meat with gravy (potatoes reported separately)"
27120020.00,"HAM/PORK W/ GRAVY (MIXTURE)","Ham or pork with gravy (mixture)"
27120030.00,"HAM/PORK W/ BARBECUE SAUCE","Ham or pork with barbecue sauce (mixture)"
27120060.00,"SWEET & SOUR PORK","Sweet and sour pork"
27120080.00,"HAM STROGANOFF (INCL HAM W/ CREAM OR WHITE SAUCE)","Ham stroganoff"
27120090.00,"HAM/PORK W/ (MUSHROOM) SOUP-BASE SAUCE (MIXTURE)","Ham or pork with (mushroom) soup (mixture)"
27120100.00,"HAM/PORK W/ TOMATO-BASED SAUCE (MIXTURE)","Ham or pork with tomato-based sauce (mixture)"
27120110.00,"SAUSAGE W/ TOMATO-BASED SAUCE (MIXTURE)","Sausage with tomato-based sauce (mixture)"
27120120.00,"SAUSAGE GRAVY","Sausage gravy"
27120130.00,"MEXICAN STYLE PORK STEW,NO POT,TOM-BASE SCE(MIXTUR","Mexican style pork stew, no potatoes, tomato-based sauce (mixture) (cerdo guisado sin papas)"
27120150.00,"PORK OR HAM W/ SOY-BASED SAUCE (MIXTURE)","Pork or ham with soy-based sauce (mixture)"
27120210.00,"FRANKFURTER /HOT DOG,W/CHILI,NO BUN (INCL CHILI DOG,NO BUN)","Frankfurter or hot dog, with chili, no bun"
27120250.00,"FRANKFURTERS/HOT DOGS W/ TOM-BASED SCE (MIXTURE)","Frankfurters or hot dogs with tomato-based sauce (mixture)"
27121000.00,"PORK W/ CHILE & TOM (MIXTURE) (PUERCO CON CHILE)","Pork with chili and tomatoes (mixture) (Puerco con chile)"
27121010.00,"STEWED PORK, P.R.","Stewed pork, Puerto Rican style"
27121410.00,"CHILI CON CARNE W/ BEANS, MADE W/ PORK","Chili con carne with beans, made with pork"
27130010.00,"LAMB W/ GRAVY (MIXTURE)","Lamb or mutton with gravy (mixture)"
27130040.00,"SPAGHETTI SAUCE W/ LAMB, HOMEMADE-STYLE","Spaghetti sauce with lamb or mutton, homemade-style"
27130100.00,"LAMB CURRY","Lamb curry"
27133010.00,"STEWED GOAT, P.R. (CABRITO EN FRICASE)","Stewed goat, Puerto Rican style (Cabrito en fricase, chilindron de chivo)"
27135010.00,"VEAL W/ GRAVY (MIXTURE)","Veal with gravy (mixture)"
27135020.00,"VEAL SCALLOPINI","Veal scallopini"
27135040.00,"VEAL W/ BUTTER SAUCE","Veal with butter sauce (mixture)"
27135050.00,"VEAL MARSALA","Veal Marsala"
27135110.00,"VEAL PARMIGIANA","Veal parmigiana"
27136050.00,"VENISON/DEER W/ TOMATO-BASED SAUCE (MIXTURE)","Venison/deer with tomato-based sauce (mixture)"
27136080.00,"VENISON/DEER W/ GRAVY","Venison/deer with gravy (mixture)"
27136100.00,"CHILI CON CARNE W/ VENISON/DEER & BEANS","Chili con carne with venison/deer and beans"
27141000.00,"CHICKEN CACCIATORE (INCLUDE CHICKEN W/TOMATO SAUCE)","Chicken or turkey cacciatore"
27141030.00,"SPAGHETTI SAUCE W/ POULTRY, HOMEMADE","Spaghetti sauce with poultry, home-made style"
27141050.00,"STEWED CHICKEN W/ TOMATO SAUCE, MEXICAN STYLE","Stewed chicken with tomato-based sauce, Mexican style (mixture) (Pollo guisado con tomate)"
27141500.00,"CHILI CON CARNE W/ CHICKEN & BEANS","Chili con carne with chicken or turkey and beans"
27142000.00,"CHICKEN W/ GRAVY (MIXTURE)","Chicken with gravy (mixture)"
27142100.00,"CHICKEN FRICASSEE","Chicken or turkey fricassee"
27142200.00,"TURKEY W/ GRAVY (MIXTURE)","Turkey with gravy (mixture)"
27143000.00,"CHICKEN OR TURKEY W/ CREAM SAUCE (MIXTURE)","Chicken or turkey with cream sauce (mixture)"
27144000.00,"CHICKEN W/ (MUSHROOM) SOUP-BASED SAUCE (MIXTURE)","Chicken or turkey with (mushroom) soup (mixture)"
27145000.00,"CHICKEN TERIYAKI","Chicken or turkey teriyaki (chicken or turkey with soy-based sauce)"
27146000.00,"CHICKEN OR TURKEY W/ BBQ SAUCE, SKIN EATEN","Chicken or turkey with barbecue sauce, skin eaten"
27146010.00,"CHICKEN OR TURKEY W/ BBQ SAUCE, SKIN NOT EATEN","Chicken or turkey with barbecue sauce, skin not eaten"
27146050.00,"CHICKEN WING W/ HOT PEPPER SCE (INCL BUFFALO WING)","Chicken wing with hot pepper sauce"
27146100.00,"SWEET & SOUR CHICKEN","Sweet and sour chicken or turkey"
27146150.00,"CHICKEN CURRY","Chicken curry"
27146160.00,"CHICKEN WITH MOLE SAUCE","Chicken with mole sauce"
27146200.00,"CHICKEN W/ CHEESE SAUCE (MIXTURE)","Chicken or turkey with cheese sauce (mixture)"
27146250.00,"CHICKEN CORDON BLEU","Chicken or turkey cordon bleu"
27146300.00,"CHICKEN PARMIGIANA","Chicken or turkey parmigiana"
27146350.00,"LEMON CHICKEN, CHINESE STYLE","Lemon chicken, Chinese style"
27146400.00,"CHICKEN KIEV","Chicken kiev"
27148010.00,"STUFFED CHICKEN, DRUMSTICK OR BREAST, P.R.","Stuffed chicken, drumstick or breast, Puerto Rican style (Muslo de pollo o pechuga rellena)"
27150010.00,"FISH W/ CREAM OR WHITE SAUCE, NOT TUNA OR LOBSTER","Fish with cream or white sauce, not tuna or lobster (mixture)"
27150020.00,"CRAB, DEVILED","Crab, deviled"
27150030.00,"CRAB IMPERIAL (INCLUDE STUFFED CRAB)","Crab imperial"
27150050.00,"FISH TIMBALE OR MOUSSE","Fish timbale or mousse"
27150060.00,"LOBSTER NEWBURG (INCLUDE LOBSTER THERMIDOR)","Lobster newburg"
27150070.00,"LOBSTER W/ BUTTER SAUCE (INCLUDE LOBSTER NORFOLK)","Lobster with butter sauce (mixture)"
27150100.00,"SHRIMP CURRY","Shrimp curry"
27150110.00,"SHRIMP COCKTAIL (SHRIMP W/ COCKTAIL SAUCE)","Shrimp cocktail (shrimp with cocktail sauce)"
27150120.00,"TUNA W/ CREAM OR WHITE SAUCE (MIXTURE)","Tuna with cream or white sauce (mixture)"
27150130.00,"SEAFOOD NEWBURG (INCLUDE CRABMEAT THERMIDOR)","Seafood newburg"
27150140.00,"CLAM SAUCE, WHITE","Clam sauce, white"
27150160.00,"SHRIMP W/ LOBSTER SAUCE (MIXTURE)","Shrimp with lobster sauce (mixture)"
27150170.00,"SWEET & SOUR SHRIMP","Sweet and sour shrimp"
27150190.00,"LOBSTER SAUCE (BROTH-BASED)","Lobster sauce (broth-based)"
27150200.00,"OYSTER SCE (WHITE SCE-BASED)","Oyster sauce (white sauce-based)"
27150210.00,"FISH SAUCE (BAGOONG)","Fish sauce (bagoong)"
27150230.00,"SHRIMP SCAMPI","Shrimp scampi"
27150310.00,"FISH W/ TOMATO-BASED SAUCE (MIXTURE)","Fish with tomato-based sauce (mixture)"
27150320.00,"FISH CURRY","Fish curry"
27150330.00,"MUSSELS W/ TOMATO-BASED SAUCE (MIXTURE)","Mussels with tomato-based sauce (mixture)"
27150350.00,"SARDINES W/ TOMATO-BASED SAUCE (MIXTURE)","Sardines with tomato-based sauce (mixture)"
27150370.00,"SARDINES W/ MUSTARD SAUCE (MIXTURE)","Sardines with mustard sauce (mixture)"
27150410.00,"SHRIMP TERIYAKI","Shrimp teriyaki (shrimp with soy-based sauce) (mixture)"
27150510.00,"SCALLOPS W/ CHEESE SAUCE (MIXTURE)","Scallops with cheese sauce (mixture)"
27151030.00,"MARINATED FISH (CEVICHE)","Marinated fish (Ceviche)"
27151040.00,"CRABS IN TOMATO-BASED SAUCE, PUERTO RICAN STYLE","Crabs in tomato-based sauce, Puerto Rican style (mixture) (Salmorejo de jueyes)"
27151050.00,"SHRIMP IN GARLIC SAUCE, P.R. (CAMARONES AL AJILLO)","Shrimp in garlic sauce, Puerto Rican style (mixture) (Camarones al ajillo)"
27151070.00,"STEWED CODFISH, P.R.","Stewed codfish, Puerto Rican style"
27160010.00,"MEAT W/ BARBECUE SAUCE, NS AS TO TYPE OF MEAT","Meat with barbecue sauce, NS as to type of meat (mixture)"
27160100.00,"MEATBALLS, NS AS TO TYPE OF MEAT, W/ SAUCE","Meatballs, NS as to type of meat, with sauce (mixture)"
27162010.00,"MEAT W/ TOMATO-BASED SAUCE","Meat with tomato-based sauce (mixture)"
27162050.00,"SPAGHETTI SAUCE W/ COMBINATION OF MEATS, HOMEMADE","Spaghetti sauce with combination of meats, homemade-style"
27162060.00,"SPAGHETTI SAUCE W/ MEAT & VEGETABLES, HOMEMADE-STYLE","Spaghetti sauce with meat and vegetables, homemade-style"
27163010.00,"MEAT W/ GRAVY, NS AS TO TYPE OF MEAT (MIXTURE)","Meat with gravy, NS as to type of meat (mixture)"
27211000.00,"BEEF & POTATOES, NO SAUCE (MIXTURE)","Beef and potatoes, no sauce (mixture)"
27211100.00,"BEEF STEW W/ POTATOES, TOMATO-BASED SAUCE","Beef stew with potatoes, tomato-based sauce (mixture)"
27211110.00,"MEXICAN BEEF STEW W/POT,TOM SCE (CARNE GUISADA CON)","Mexican style beef stew with potatoes, tomato-based sauce (mixture) (Carne guisada con papas)"
27211150.00,"BEEF GOULASH W/ POTATOES (INCL BEEF GOULASH, NFS)","Beef goulash with potatoes"
27211170.00,"BEEF & POTATOES W/ (MUSHROOM) SOUP (MIXTURE)","Beef and potatoes with (mushroom) soup (mixture)"
27211190.00,"BEEF & POTATOES W/ CREAM, WHITE, MUSHROOM SOUP SCE (MIXTURE)","Beef and potatoes with cream sauce, white sauce or mushroom soup-based sauce (mixture)"
27211200.00,"BEEF STEW W/ POTATOES, GRAVY","Beef stew with potatoes, gravy"
27211300.00,"BEEF (ROAST) HASH","Beef (roast) hash"
27211400.00,"CORNED BEEF HASH","Corned beef hash"
27211500.00,"BEEF & POTATOES W/ CHEESE SAUCE (MIXTURE)","Beef and potatoes with cheese sauce (mixture)"
27211550.00,"STEWED SEASONED GROUND BEEF W/ POTATOES, MEXICAN","Stewed, seasoned, ground beef with potatoes, Mexican style (Picadillo de carne de rez con papas)"
27212000.00,"BEEF & NOODLES, NO SAUCE","Beef and noodles, no sauce (mixture)"
27212050.00,"BEEF & MACARONI WITH CHEESE SAUCE (MIXTURE)","Beef and macaroni with cheese sauce (mixture)"
27212100.00,"BEEF & NOODLES W/ TOMATO-BASED SAUCE (MIXTURE)","Beef and noodles with tomato-based sauce (mixture)"
27212120.00,"CHILI CON CARNE W/ BEANS & MACARONI","Chili con carne with beans and macaroni"
27212150.00,"BEEF GOULASH W/ NOODLES","Beef goulash with noodles"
27212200.00,"BEEF & NOODLES W/ GRAVY (MIXTURE)","Beef and noodles with gravy (mixture)"
27212300.00,"BEEF & NOODLES W/ CREAM OR WHITE SAUCE (MIXTURE)","Beef and noodles with cream or white sauce (mixture)"
27212350.00,"BEEF STROGANOFF W/ NOODLES","Beef stroganoff with noodles"
27212400.00,"BEEF & NOODLES W/ (MUSHROOM) SOUP (MIXTURE)","Beef and noodles with (mushroom) soup (mixture)"
27213000.00,"BEEF & RICE, NO SAUCE (MIXTURE)","Beef and rice, no sauce (mixture)"
27213100.00,"BEEF & RICE W/ TOMATO-BASED SAUCE (MIXTURE)","Beef and rice with tomato-based sauce (mixture)"
27213120.00,"PORCUPINE BALLS W/ TOMATO-BASED SAUCE (MIXTURE)","Porcupine balls with tomato-based sauce (mixture)"
27213150.00,"CHILI CON CARNE W/ BEANS & RICE","Chili con carne with beans and rice"
27213200.00,"BEEF & RICE W/ GRAVY (MIXTURE)","Beef and rice with gravy (mixture)"
27213300.00,"BEEF & RICE W/ CREAM SAUCE (MIXTURE)","Beef and rice with cream sauce (mixture)"
27213400.00,"BEEF & RICE W/ (MUSHROOM) SOUP (MIXTURE)","Beef and rice with (mushroom) soup (mixture)"
27213420.00,"PORCUPINE BALLS W/ (MUSHROOM) SOUP (MIXTURE)","Porcupine balls with (mushroom) soup (mixture)"
27213500.00,"BEEF & RICE W/ SOY-BASED SAUCE (MIXTURE)","Beef and rice with soy-based sauce (mixture)"
27213600.00,"BEEF AND RICE WITH CHEESE SAUCE (MIXTURE)","Beef and rice with cheese sauce (mixture)"
27214100.00,"MEAT LOAF MADE W/ BEEF","Meat loaf made with beef"
27214110.00,"MEAT LOAF W/ BEEF, W/ TOMATO SAUCE","Meat loaf made with beef, with tomato-based sauce"
27214500.00,"CORNED BEEF PATTY","Corned beef patty"
27218210.00,"BEEF STEW, P.R. W/ POTATOES (CARNE GUISADA CON PAPAS)","Puerto Rican style beef stew with potatoes (Carne guisada con papas)"
27218310.00,"STEWED CORNED BEEF, P.R. (""CORNED BEEF"" GUISADO)","Stewed corned beef, Puerto Rican style (""Corned beef"" guisado)"
27220010.00,"MEAT LOAF MADE W/ HAM (NOT LUNCHEON MEAT)","Meat loaf made with ham (not luncheon meat)"
27220020.00,"HAM & NOODLES W/ CREAM OR WHITE SAUCE (MIXTURE)","Ham and noodles with cream or white sauce (mixture)"
27220030.00,"HAM & RICE W/ (MUSHROOM) SOUP (MIXTURE)","Ham and rice with (mushroom) soup (mixture)"
27220050.00,"HAM OR PORK  W/ STUFFING","Ham or pork with stuffing (mixture)"
27220080.00,"HAM CROQUETTE","Ham croquette"
27220110.00,"PORK & RICE W/ TOMATO-BASED SAUCE (MIXTURE)","Pork and rice with tomato-based sauce (mixture)"
27220120.00,"SAUSAGE & RICE W/ TOMATO-BASED SAUCE (MIXTURE)","Sausage and rice with tomato-based sauce (mixture)"
27220150.00,"SAUSAGE & RICE W/ (MUSHROOM) SOUP (MIXTURE)","Sausage and rice with (mushroom) soup (mixture)"
27220170.00,"SAUSAGE & RICE W/ CHEESE SAUCE (MIXTURE)","Sausage and rice with cheese sauce (mixture)"
27220190.00,"SAUSAGE & NOODLES W/ CREAM OR WHITE SAUCE (MIXTURE)","Sausage and noodles with cream or white sauce (mixture)"
27220210.00,"HAM & NOODLES, NO SAUCE (MIXTURE)","Ham and noodles, no sauce (mixture)"
27220310.00,"HAM & RICE, NO SAUCE (MIXTURE)","Ham or pork and rice, no sauce (mixture)"
27220510.00,"HAM/PORK & POTATOES W/ GRAVY (MIXTURE)","Ham or pork and potatoes with gravy (mixture)"
27220520.00,"PORK & POTATOES W/ CHEESE SAUCE","Ham or pork and potatoes with cheese sauce (mixture)"
27221100.00,"STEWED PIG'S FEET, P.R. (PATITAS DE CERDO GUISADAS)","Stewed pig's feet, Puerto Rican style (Patitas de cerdo guisadas)"
27221150.00,"MEXICAN STYLE PORK STEW W/POT,TOM-BASE SCE(MIXTURE)","Mexican style pork stew, with potatoes, tomato-based sauce (mixture) (cerdo guisado con papas)"
27230010.00,"LAMB LOAF","Lamb or mutton loaf"
27231000.00,"LAMB OR MUTTON & POTATOES W/ GRAVY (MIXTURE)","Lamb or mutton and potatoes with gravy (mixture)"
27232000.00,"LAMB & POTATOES W/ TOMATO-BASED SAUCE (MIXTURE)","Lamb or mutton and potatoes with tomato-based sauce (mixture)"
27235000.00,"MEAT LOAF MADE WITH VENISON/DEER","Meat loaf made with venison/deer"
27236000.00,"VENISON/DEER & NOODLE MIXTURE W/ CREAM/WHITE SAUCE","Venison/deer and noodles with cream or white sauce (mixture)"
27241000.00,"CHICKEN OR TURKEY HASH","Chicken or turkey hash"
27241010.00,"CHICKEN OR TURKEY & POTATOES W/ GRAVY (MIXTURE)","Chicken or turkey and potatoes with gravy (mixture)"
27242000.00,"CHICKEN OR TURKEY & NOODLES, NO SAUCE (MIXTURE)","Chicken or turkey and noodles, no sauce (mixture)"
27242200.00,"CHICKEN OR TURKEY & NOODLES W/ GRAVY (MIXTURE)","Chicken or turkey and noodles with gravy (mixture)"
27242250.00,"CHICKEN OR TURKEY & NOODLES W/ (MUSHROOM) SOUP","Chicken or turkey and noodles with (mushroom) soup (mixture)"
27242300.00,"CHICKEN OR TURKEY & NOODLES W/ CREAM OR WHITE SAUCE","Chicken or turkey and noodles with cream or white sauce (mixture)"
27242310.00,"CHICKEN & NOODLES W/ CHEESE SAUCE","Chicken or turkey and noodles with cheese sauce (mixture)"
27242350.00,"CHICKEN OR TURKEY TETRAZZINI","Chicken or turkey tetrazzini"
27242400.00,"CHICKEN & NOODLES, TOMATO-BASED SAUCE (MIXTURE)","Chicken or turkey and noodles, tomato-based sauce (mixture)"
27243000.00,"CHICKEN & RICE, NO SAUCE (MIXTURE)","Chicken or turkey and rice, no sauce (mixture)"
27243300.00,"CHICKEN & RICE W/ CREAM SAUCE (MIXTURE)","Chicken or turkey and rice with cream sauce (mixture)"
27243400.00,"CHICKEN & RICE W/ (MUSHROOM) SOUP-BASED SAUCE","Chicken or turkey and rice with (mushroom) soup (mixture)"
27243500.00,"CHICKEN & RICE W/ TOMATO-BASED SAUCE (MIXTURE)","Chicken or turkey and rice with tomato-based sauce (mixture)"
27243600.00,"CHICKEN & RICE W/ SOY-BASED SAUCE (MIXTURE)","Chicken or turkey and rice with soy-based sauce (mixture)"
27243700.00,"CHICKEN IN CHEESE SCE W/ SPANISH RICE","Chicken in cheese sauce with Spanish rice"
27246100.00,"CHICKEN W/ DUMPLINGS (MIXTURE)","Chicken or turkey with dumplings (mixture)"
27246200.00,"CHICKEN W/ STUFFING (MIXTURE)","Chicken or turkey with stuffing (mixture)"
27246300.00,"CHICKEN OR TURKEY CAKE, PATTY OR CROQUETTE","Chicken or turkey cake, patty, or croquette"
27246400.00,"CHICKEN SOUFFLE","Chicken or turkey souffle"
27246500.00,"MEAT LOAF MADE W/ CHICKEN OR TURKEY","Meat loaf made with chicken or turkey"
27250020.00,"CLAMS, STUFFED","Clams, stuffed"
27250030.00,"CODFISH BALL OR CAKE","Codfish ball or cake"
27250040.00,"CRAB CAKE","Crab cake"
27250050.00,"FISH CAKE OR PATTY, NS AS TO FISH","Fish cake or patty, NS as to fish"
27250060.00,"GEFILTE FISH","Gefilte fish"
27250070.00,"SALMON CAKE OR PATTY (INCLUDE SALMON CROQUETTE)","Salmon cake or patty"
27250080.00,"SALMON LOAF","Salmon loaf"
27250110.00,"SCALLOPS & NOODLES W/ CHEESE SAUCE (MIXTURE)","Scallops and noodles with cheese sauce (mixture)"
27250120.00,"SHRIMP AND NOODLES, NO SAUCE (MIXTURE)","Shrimp and noodles, no sauce (mixture)"
27250126.00,"SHRIMP AND NOODLES WITH CREAM OR WHITE SAUCE (MIXTURE)","Shrimp and noodles with cream or white sauce (mixture)"
27250130.00,"SHRIMP & NOODLES W/ CHEESE SAUCE","Shrimp and noodles with cheese sauce (mixture)"
27250132.00,"SHRIMP AND NOODLES WITH TOMATO SAUCE (MIXTURE)","Shrimp and noodles with tomato sauce (mixture)"
27250150.00,"TUNA LOAF","Tuna loaf"
27250160.00,"TUNA CAKE OR PATTY","Tuna cake or patty"
27250210.00,"CLAM CAKE OR PATTY (INCLUDE DEVILED)","Clam cake or patty"
27250250.00,"FLOUNDER W/CRAB STUFFING","Flounder with crab stuffing"
27250260.00,"LOBSTER W/ BREAD STUFFING,BAKED","Lobster with bread stuffing, baked"
27250270.00,"CLAMS, CASINO","Clams Casino"
27250300.00,"MACKEREL CAKE OR PATTY","Mackerel cake or patty"
27250400.00,"SHRIMP CAKE OR PATTY (INCL SHRIMP BURGER OR STICK)","Shrimp cake or patty"
27250410.00,"SHRIMP W/ CRAB STUFFING","Shrimp with crab stuffing"
27250450.00,"SHRIMP TOAST, FRIED","Shrimp toast, fried"
27250510.00,"FISH CAKE (KAMABOKO) TEMPURA","Fish cake (Kamaboko) tempura"
27250520.00,"SEAFOOD, RESTRUCTURED (INCL IMITATION CRABMEAT)","Seafood restructured"
27250550.00,"SEAFOOD SOUFFLE","Seafood souffle"
27250610.00,"TUNA NOODLE CASSEROLE W/ CREAM OR WHITE SAUCE","Tuna noodle casserole with cream or white sauce"
27250630.00,"TUNA NOODLE CASSEROLE W/ (MUSHROOM) SOUP","Tuna noodle casserole with (mushroom) soup"
27250710.00,"TUNA & RICE W/ (MUSHROOM) SOUP (MIXTURE)","Tuna and rice with (mushroom) soup (mixture)"
27250810.00,"FISH & RICE W/ TOMATO-BASED SAUCE","Fish and rice with tomato-based sauce"
27250820.00,"FISH & RICE W/ CREAM SAUCE","Fish and rice with cream sauce"
27250830.00,"FISH & RICE W/ (MUSHROOM) SOUP","Fish and rice with (mushroom) soup"
27250900.00,"FISH & NOODLES W/ (MUSHROOM) SOUP (MIXTURE)","Fish and noodles with (mushroom) soup"
27250950.00,"SHELLFISH & NOODLES, TOMATO-BASED SAUCE","Shellfish mixture and noodles, tomato-based sauce (mixture)"
27260010.00,"MEATLOAF, NS AS TO TYPE OF MEAT","Meat loaf, NS as to type of meat"
27260050.00,"MEATBALLS, W/ BREADING, W/ GRAVY","Meatballs, with breading, NS as to type of meat, with gravy"
27260080.00,"MEAT LOAF MADE W/ BEEF & PORK","Meat loaf made with beef and pork"
27260090.00,"MEAT LOAF W/ BEEF, VEAL & PORK","Meat loaf made with beef, veal and pork"
27260100.00,"MEAT LOAF W/ BEEF & PORK, W/ TOMATO SAUCE","Meat loaf made with beef and pork, with tomato-based sauce"
27260110.00,"HASH, NS AS TO TYPE OF MEAT","Hash, NS as to type of meat"
27260500.00,"VIENNA SAUSAGES STEWED W/ POTATOES, P.R.","Vienna sausages stewed with potatoes, Puerto Rican style (Salchichas guisadas)"
27260510.00,"LIVER DUMPLING","Liver dumpling"
27311110.00,"BEEF, POTATOES, & VEG (W/ CAR/DK GREEN), NO SAUCE","Beef, potatoes, and vegetables (including carrots, broccoli, and/or dark-green leafy), no sauce (mixture)"
27311120.00,"BEEF, POTATOES, & VEG (NO CAR/DK GREEN), NO SAUCE","Beef, potatoes, and vegetables (excluding carrots, broccoli, and dark-green leafy), no sauce (mixture)"
27311210.00,"CORNED BEEF, POT & VEG(W/ CAR/DK GREEN), NO SAUCE","Corned beef, potatoes, and vegetables (including carrots, broccoli, and/or dark-green leafy), no sauce (mixture)"
27311220.00,"CORNED BEEF, POTATO & VEG (NO CAR/DK GRN), NO SAUCE","Corned beef, potatoes, and vegetables (excluding carrots, broccoli, and dark-green leafy), no sauce (mixture)"
27311310.00,"BEEF STEW W/ POT & VEG(W/ CAR/DK GRN), TOMATO SAUCE","Beef stew with potatoes and vegetables (including carrots, broccoli, and/or dark-green leafy), tomato-based sauce"
27311320.00,"BEEF STEW W/ POT & VEG (NO CAR/DK GREEN), TOM SAUCE","Beef stew with potatoes and vegetables (excluding carrots, broccoli, and dark-green leafy), tomato-based sauce"
27311410.00,"BEEF STEW W/ POT & VEG (W/ CAR, DK GREEN), GRAVY","Beef stew with potatoes and vegetables (including carrots, broccoli, and/or dark-green leafy), gravy"
27311420.00,"BEEF STEW W/ POT & VEG (NO CAR, DK GREEN), GRAVY","Beef stew with potatoes and vegetables (excluding carrots, broccoli, and dark-green leafy), gravy"
27311510.00,"SHEPHERD'S PIE W/ BEEF","Shepherd's pie with beef"
27311610.00,"BEEF, POT & VEG (INCL CAR/DK GRN), CR/SOUP-BASED SAUCE","Beef, potatoes, and vegetables (including carrots, broccoli, and/or dark-green leafy), cream sauce, white sauce, or mushroom soup-based sauce (mixture)"
27311620.00,"BEEF, POT & VEG (NO CAR/DK GRN), CR/SOUP-BASED SAUCE","Beef, potatoes, and vegetables (excluding carrots, broccoli, and dark-green leafy), cream sauce, white sauce, or mushroom soup-based sauce (mixture)"
27311630.00,"BEEF, POT, & VEG (NO CAR/DK GREEN), TOMATO-BASED SAUCE","Beef, potatoes, and vegetables (excluding carrots, broccoli, and dark-green leafy), tomato-based sauce (mixture)"
27311635.00,"BEEF, POT, & VEG (INCL CAR/DK GRN), CHEESE SAUCE","Beef, potatoes, and vegetables (including carrots, broccoli, and/or dark-green leafy), cheese sauce (mixture)"
27311640.00,"BEEF, POT, & VEG (NO CAR/DK GREEN), CHEESE SAUCE","Beef, potatoes, and vegetables (excluding carrots, broccoli, and dark-green leafy), cheese sauce (mixture)"
27311650.00,"BEEF, POT, & VEG (NO CAR/DK GREEN), SOY-BASED SAUCE","Beef, potatoes, and vegetables (excluding carrots, broccoli, and dark-green leafy), soy-based sauce (mixture)"
27313010.00,"BEEF, NOODLES & VEG (W/ CARROTS/DK GREEN), NO SAUCE","Beef, noodles, and vegetables (including carrots, broccoli, and/or dark-green leafy), no sauce (mixture)"
27313020.00,"BEEF, NOODLES & VEG (NO CARROTS/DK GREEN), NO SAUCE","Beef, noodles, and vegetables (excluding carrots, broccoli, and dark-green leafy), no sauce (mixture)"
27313110.00,"BEEF CHOW MEIN OR CHOP SUEY W/ NOODLES","Beef chow mein or chop suey with noodles"
27313150.00,"BEEF, NOODLES & VEG (W/ CAR/DK GREEN), SOY SAUCE","Beef, noodles, and vegetables (including carrots, broccoli, and/or dark-green leafy), soy-based sauce (mixture)"
27313160.00,"BEEF, NOODLES & VEG (NO CAR/DK GREEN), SOY SAUCE","Beef, noodles, and vegetables (excluding carrots, broccoli, and dark-green leafy), soy-based sauce (mixture)"
27313210.00,"BEEF, NOODLES & VEG (W/ CAR/DK GREEN), TOMATO SAUCE","Beef, noodles, and vegetables (including carrots, broccoli, and/or dark-green leafy), tomato-based sauce (mixture)"
27313220.00,"BEEF, NOODLES & VEG (NO CAR/DK GREEN), TOMATO SAUCE","Beef, noodles, and vegetables (excluding carrots, broccoli, and dark-green leafy), tomato-based sauce (mixture)"
27313310.00,"BEEF, NOODLES, VEG(INCL CARROTS/DK GREEN), SOUP","Beef, noodles, and vegetables (including carrots, broccoli, and/or dark-green leafy), (mushroom) soup (mixture)"
27313320.00,"BEEF, NOODLES, VEG (NO CARROTS/DK GREEN), SOUP","Beef, noodles, and vegetables (excluding carrots, broccoli, and dark-green leafy), (mushroom) soup (mixture)"
27313410.00,"BEEF, NOODLES, & VEG (INCL CAR/DK GRN), GRAVY","Beef, noodles, and vegetables (including carrots, broccoli, and/or dark-green leafy), gravy (mixture)"
27313420.00,"BEEF, NOODLES, & VEG (NO CAR/DK GRN), GRAVY","Beef, noodles, and vegetables (excluding carrots, broccoli, and dark-green leafy), gravy (mixture)"
27315010.00,"BEEF, RICE & VEG (W/ CARROTS/DK GREEN), NO SAUCE","Beef, rice, and vegetables (including carrots, broccoli, and/or dark-green leafy), no sauce (mixture)"
27315020.00,"BEEF, RICE & VEG (NO CARROTS/DK GREEN), NO SAUCE","Beef, rice, and vegetables (excluding carrots, broccoli, and dark-green leafy), no sauce (mixture)"
27315210.00,"BEEF, RICE & VEG (W/ CAR/DK GREEN), TOMATO SAUCE","Beef, rice, and vegetables (including carrots, broccoli, and/or dark-green leafy), tomato-based sauce (mixture)"
27315220.00,"BEEF, RICE & VEG (NO CAR/DK GREEN), TOMATO SAUCE","Beef, rice, and vegetables (excluding carrots, broccoli, and/or dark-green leafy), tomato-based sauce (mixture)"
27315250.00,"STUFFED CABBAGE ROLLS W/ BEEF AND RICE","Stuffed cabbage rolls with beef and rice"
27315270.00,"STUFFED GRAPE LEAVES W/ BEEF & RICE","Stuffed grape leaves with beef and rice"
27315310.00,"BEEF, RICE & VEGETABLES (W/ CARROTS/DK GREEN), SOUP","Beef, rice, and vegetables (including carrots, broccoli, and/or dark-green leafy), (mushroom) soup (mixture)"
27315320.00,"BEEF, RICE & VEGETABLES (NO CARROTS/DK GREEN), SOUP","Beef, rice, and vegetables (excluding carrots, broccoli, and dark-green leafy), (mushroom) soup (mixture)"
27315340.00,"BEEF, RICE & VEG (NO CAR/DK GRN), CHEESE SAUCE","Beef, rice, and vegetables (excluding carrots, broccoli, and dark-green leafy), cheese sauce (mixture)"
27315410.00,"BEEF, RICE & VEG (INCL CAR/DK GRN), GRAVY, MIXTURE","Beef, rice, and vegetables (including carrots, broccoli, and/or dark-green leafy), gravy (mixture)"
27315420.00,"BEEF, RICE & VEG (NO CAR/DK GRN), GRAVY, MIXTURE","Beef, rice, and vegetables (excluding carrots, broccoli, and dark-green leafy), gravy (mixture)"
