"Food_Code","Food_Abbrev_Desc","Food_Desc"
53260400.00,"COOKIE, DIETETIC, SUGAR OR PLAIN","Cookie, dietetic, sugar or plain"
53270100.00,"COOKIE, P.R. (MANTECADITOS POLVORONES)","Cookies, Puerto Rican (Mantecaditos polvorones)"
53300100.00,"PIE, NFS","Pie, NFS"
53300170.00,"PIE, INDIVIDUAL SIZE OR TART, NFS","Pie, individual size or tart, NFS"
53301000.00,"PIE, APPLE, TWO CRUST","Pie, apple, two crust"
53301070.00,"PIE, APPLE, INDIVIDUAL SIZE OR TART","Pie, apple, individual size or tart"
53301080.00,"PIE, APPLE, FRIED (INCLUDE MCDONALD'S)","Pie, apple, fried pie"
53301500.00,"PIE, APPLE, ONE CRUST (INCL W/ CRUMB TOPPING)","Pie, apple, one crust"
53301750.00,"PIE, APPLE, DIET","Pie, apple, diet"
53302000.00,"PIE, APRICOT, TWO CRUST","Pie, apricot, two crust"
53302070.00,"PIE, APRICOT, INDIVIDUAL SIZE OR TART","Pie, apricot, individual size or tart"
53302080.00,"PIE, APRICOT, FRIED","Pie, apricot, fried pie"
53303000.00,"PIE, BLACKBERRY, TWO CRUST","Pie, blackberry, two crust"
53303070.00,"PIE, BLACKBERRY, INDIVIDUAL SIZE OR TART","Pie, blackberry, individual size or tart"
53303500.00,"PIE, BERRY NOT BLACK,BLUE,BOYSEN,RASP....,TWO CRUST","Pie, berry, not blackberry, blueberry, boysenberry, huckleberry, raspberry, or strawberry; two crust"
53303510.00,"PIE, BERRY, ONE CRUST","Pie, berry, not blackberry, blueberry, boysenberry, huckleberry, raspberry, or strawberry; one crust"
53303570.00,"PIE, BERRY, INDIVIDUAL SIZE OR TART","Pie, berry, not blackberry, blueberry, boysenberry, huckleberry, raspberry, or strawberry, individual size or tart"
53304000.00,"PIE, BLUEBERRY, TWO CRUST","Pie, blueberry, two crust"
53304050.00,"PIE, BLUEBERRY, ONE CRUST","Pie, blueberry, one crust"
53304070.00,"PIE, BLUEBERRY, INDIVIDUAL SIZE OR TART","Pie, blueberry, individual size or tart"
53305000.00,"PIE, CHERRY, TWO CRUST","Pie, cherry, two crust"
53305010.00,"PIE, CHERRY, ONE CRUST","Pie, cherry, one crust"
53305070.00,"PIE, CHERRY, INDIVIDUAL SIZE OR TART","Pie, cherry, individual size or tart"
53305080.00,"PIE, CHERRY, FRIED (INCLUDE MCDONALD'S)","Pie, cherry, fried pie"
53305700.00,"PIE, LEMON (NOT CREAM OR MERINGUE)","Pie, lemon (not cream or meringue)"
53305720.00,"PIE, LEMON (NOT CREAM OR MERINGUE), INDIVIDUAL SIZE","Pie, lemon (not cream or meringue), individual size or tart"
53306000.00,"PIE, MINCE, TWO CRUST","Pie, mince, two crust"
53306070.00,"PIE, MINCE, INDIVIDUAL SIZE OR TART","Pie, mince, individual size or tart"
53307000.00,"PIE, PEACH, TWO CRUST","Pie, peach, two crust"
53307050.00,"PIE, PEACH, ONE-CRUST","Pie, peach, one crust"
53307070.00,"PIE, PEACH, INDIVIDUAL SIZE OR TART","Pie, peach, individual size or tart"
53307080.00,"PIE, PEACH, FRIED","Pie, peach, fried pie"
53307500.00,"PIE, PEAR, TWO CRUST","Pie, pear, two crust"
53308000.00,"PIE, PINEAPPLE, TWO CRUST","Pie, pineapple, two crust"
53308070.00,"PIE, PINEAPPLE, INDIVIDUAL SIZE OR TART","Pie, pineapple, individual size or tart"
53308300.00,"PIE, PLUM, TWO CRUST","Pie, plum, two crust"
53308500.00,"PIE, PRUNE, ONE CRUST","Pie, prune, one crust"
53309000.00,"PIE, RAISIN, TWO CRUST","Pie, raisin, two crust"
53309070.00,"PIE, RAISIN, INDIVIDUAL SIZE OR TART","Pie, raisin, individual size or tart"
53310000.00,"PIE, RASPBERRY, ONE CRUST","Pie, raspberry, one crust"
53310050.00,"PIE, RASPBERRY, TWO CRUST","Pie, raspberry, two crust"
53311000.00,"PIE, RHUBARB, TWO CRUST","Pie, rhubarb, two crust"
53311050.00,"PIE, RHUBARB, ONE CRUST","Pie, rhubarb, one crust"
53312000.00,"PIE, STRAWBERRY, ONE CRUST","Pie, strawberry, one crust"
53313000.00,"PIE, STRAWBERRY-RHUBARB, TWO CRUST","Pie, strawberry-rhubarb, two crust"
53314000.00,"PIE, STRAWBERRY, INDIVIDUAL SIZE OR TART","Pie, strawberry, individual size or tart"
53340000.00,"PIE, APPLE-SOUR CREAM","Pie, apple-sour cream"
53340500.00,"PIE, CHERRY, W/ CREAM CHEESE & SOUR CREAM","Pie, cherry, made with cream cheese and sour cream"
53341000.00,"PIE, BANANA CREAM","Pie, banana cream"
53341070.00,"PIE, BANANA CREAM, INDIVIDUAL SIZE OR TART","Pie, banana cream, individual size or tart"
53341500.00,"PIE, BUTTERMILK","Pie, buttermilk"
53341750.00,"PIE, CHESS (INCL LEMON CHESS PIE)","Pie, chess"
53342000.00,"PIE, CHOCOLATE CREAM","Pie, chocolate cream"
53342070.00,"PIE, CHOCOLATE CREAM, INDIVIDUAL SIZE OR TART","Pie, chocolate cream, individual size or tart"
53343000.00,"PIE, COCONUT CREAM","Pie, coconut cream"
53343070.00,"PIE, COCONUT CREAM, INDIVIDUAL SIZE OR TART","Pie, coconut cream, individual size or tart"
53344000.00,"PIE, CUSTARD","Pie, custard"
53344070.00,"PIE, CUSTARD, INDIVIDUAL SIZE OR TART","Pie, custard, individual size or tart"
53344200.00,"MIXED FRUIT TART FILLED WITH CUSTARD OR CREAM CHEESE","Mixed fruit tart filled with custard or cream cheese"
53345000.00,"PIE, LEMON CREAM","Pie, lemon cream"
53345070.00,"PIE, LEMON CREAM, INDIVIDUAL SIZE OR TART","Pie, lemon cream, individual size or tart"
53346000.00,"PIE, PEANUT BUTTER CREAM","Pie, peanut butter cream"
53346500.00,"PIE, PINEAPPLE CREAM","Pie, pineapple cream"
53347000.00,"PIE, PUMPKIN","Pie, pumpkin"
53347070.00,"PIE, PUMPKIN, INDIVIDUAL SIZE OR TART","Pie, pumpkin, individual size or tart"
53347100.00,"PIE, RASPBERRY CREAM","Pie, raspberry cream"
53347600.00,"PIE, SQUASH","Pie, squash"
53348000.00,"PIE, STRAWBERRY CREAM","Pie, strawberry cream"
53360000.00,"PIE, SWEETPOTATO","Pie, sweetpotato"
53365000.00,"PIE, VANILLA CREAM","Pie, vanilla cream"
53366000.00,"PIE, YOGURT, FROZEN","Pie, yogurt, frozen"
53370000.00,"PIE, CHIFFON, NOT CHOCOLATE","Pie, chiffon, not chocolate"
53381000.00,"PIE, LEMON MERINGUE","Pie, lemon meringue"
53382000.00,"PIE, CHOCOLATE-MARSHMALLOW","Pie, chocolate-marshmallow"
53385000.00,"PIE, PECAN","Pie, pecan"
53385070.00,"PIE, PECAN, INDIVIDUAL SIZE","Pie, pecan, individual size or tart"
53385500.00,"PIE, OATMEAL","Pie, oatmeal"
53385600.00,"PIE, PRALINE MOUSSE, W/ NUTS","Pie, praline mousse, with nuts"
53386000.00,"PIE, PUDDING, NOT CHOCOLATE","Pie, pudding, flavors other than chocolate"
53386050.00,"PIE, PUDDING, NOT CHOC, INDIVIDUAL SIZE","Pie, pudding, flavors other than chocolate, individual size or tart"
53386250.00,"PIE, PUDDING, CHOC, W/ CHOC COATING, INDIVID SIZE","Pie, pudding, chocolate, with chocolate coating, individual size"
53386500.00,"PIE, PUDDING, NOT CHOC, CHOC-COATED, INDIVID SIZE","Pie, pudding, flavors other than chocolate, with chocolate coating, individual size"
53387000.00,"PIE, TOLL HOUSE CHOCOLATE CHIP","Pie, Toll house chocolate chip"
53390000.00,"PIE, SHOO-FLY","Pie, shoo-fly"
53390100.00,"PIE, TOFU W/ FRUIT","Pie, tofu with fruit"
53391000.00,"PIE SHELL","Pie shell"
53391100.00,"PIE SHELL, GRAHAM CRACKER","Pie shell, graham cracker"
53400200.00,"BLINTZ, CHEESE-FILLED","Blintz, cheese-filled"
53400300.00,"BLINTZ, FRUIT-FILLED","Blintz, fruit-filled"
53410100.00,"COBBLER, APPLE (INCLUDE FRUIT COBBLER)","Cobbler, apple"
53410300.00,"COBBLER, BERRY","Cobbler, berry"
53410500.00,"COBBLER, CHERRY","Cobbler, cherry"
53410800.00,"COBBLER, PEACH","Cobbler, peach"
53410850.00,"COBBLER, PEAR","Cobbler, pear"
53410860.00,"COBBLER, PINEAPPLE","Cobbler, pineapple"
53410900.00,"COBBLER, RHUBARB","Cobbler, rhubarb"
53415100.00,"CRISP, APPLE, APPLE DESSERT","Crisp, apple, apple dessert"
53415120.00,"FRITTER, APPLE","Fritter, apple"
53415200.00,"FRITTER, BANANA","Fritter, banana"
53415300.00,"CRISP, BLUEBERRY","Crisp, blueberry"
53415400.00,"CRISP, CHERRY","Crisp, cherry"
53415500.00,"CRISP, PEACH","Crisp, peach"
53415600.00,"CRISP, RHUBARB","Crisp, rhubarb"
53420000.00,"CREAM PUFF/ECLAIR, CUSTARD/CREAM-FILLED, NS ICING","Cream puff, eclair, custard or cream filled, NS as to icing"
53420100.00,"CREAM PUFF/ECLAIR, CUSTARD/CREAM-FILLED, NOT ICED","Cream puff, eclair, custard or cream filled, not iced"
53420200.00,"CREAM PUFF/ECLAIR, CUSTARD/CREAM-FILLED, ICED","Cream puff, eclair, custard or cream filled, iced"
53420210.00,"CREAM PUFF/ECLAIR, CUSTARD/CREAM-FILLED, ICED, REDUCED FAT","Cream puff, eclair, custard or cream filled, iced, reduced fat"
53420250.00,"CREAM PUFFS, NO FILLING OR ICING","Cream puff, no filling or icing"
53420300.00,"AIR-FILLED FRITTER, W/O SYRUP, PUERTO RICAN STYLE","Air filled fritter or fried puff, without syrup, Puerto Rican style (Bunuelos de viento)"
53420310.00,"WHEAT FLOUR FRITTER, W/O SYRUP","Wheat flour fritter, without syrup"
53420400.00,"SOPAIPILLA W/O SYRUP OR HONEY","Sopaipilla, without syrup or honey"
53420410.00,"SOPAIPILLA W/ SYRUP OR HONEY","Sopaipilla with syrup or honey"
53430100.00,"CREPE, DESSERT TYPE, CHOCOLATE-FILLED","Crepe, dessert type, chocolate-filled"
53430200.00,"CREPE, DESSERT TYPE, FRUIT-FILLED","Crepe, dessert type, fruit-filled"
53430250.00,"CREPE SUZETTE","Crepe suzette"
53430700.00,"TAMALE, SWEET","Tamale, sweet"
53430750.00,"TAMALE, SWEET, W/ FRUIT","Tamale, sweet, with fruit"
53440000.00,"STRUDEL, APPLE (INCLUDE STRUDEL, NFS)","Strudel, apple"
53440300.00,"STRUDEL, BERRY","Strudel, berry"
53440500.00,"STRUDEL, CHERRY","Strudel, cherry"
53440600.00,"STRUDEL, CHEESE","Strudel, cheese"
53440800.00,"STRUDEL, CHEESE & FRUIT","Strudel, cheese and fruit"
53441110.00,"BAKLAVA (INCLUDE KADAYIF)","Baklava"
53441210.00,"BASBOUSA (SEMOLINA DESSERT DISH)","Basbousa (semolina dessert dish)"
53450000.00,"TURNOVER OR DUMPLING, APPLE","Turnover or dumpling, apple"
53450300.00,"TURNOVER OR DUMPLING, BERRY","Turnover or dumpling, berry"
53450500.00,"TURNOVER OR DUMPLING, CHERRY","Turnover or dumpling, cherry"
53450800.00,"TURNOVER OR DUMPLING, LEMON","Turnover or dumpling, lemon"
53451000.00,"TURNOVER OR DUMPLING, PEACH","Turnover or dumpling, peach"
53451500.00,"TURNOVER, GUAVA","Turnover, guava"
53451750.00,"TURNOVER, PUMPKIN","Turnover, pumpkin"
53452100.00,"PASTRY, FRUIT-FILLED","Pastry, fruit-filled"
53452120.00,"PASTRY,ORIENTAL,MADE W/ BEAN OR LOTUS SEED PASTE","Pastry, Oriental, made with bean or lotus seed paste filling (baked)"
53452130.00,"PASTRY,ORIENTAL,W/BEAN PASTE&SALTED EGG YOLK(BAKED)","Pastry, Oriental, made with bean paste and salted egg yolk filling (baked)"
53452150.00,"PASTRY, CHINESE (INCLUDE 9-LAYER PUDDING)","Pastry, Chinese, made with rice flour"
53452170.00,"PASTRY, COOKIE TYPE, FRIED(INCL POLISH PACZKI)","Pastry, cookie type, fried"
53452200.00,"PASTRY, ITALIAN, W/ CHEESE (INCLUDE CANNOLI)","Pastry, Italian, with cheese"
53452400.00,"PASTRY, PUFF","Pastry, puff"
53452420.00,"PASTRY, PUFF, CUSTARD/CREAM FILLED, ICED/NOT ICED","Pastry, puff, custard or cream filled, iced or not iced"
53452450.00,"CHEESE PASTRY PUFF","Cheese pastry puffs"
53452500.00,"PASTRY, MAINLY  FLOUR & WATER, FRIED","Pastry, mainly flour and water, fried"
53453150.00,"EMPANADA, MEXICAN TURNOVER, FRUIT-FILLED","Empanada, Mexican turnover, fruit-filled"
53453170.00,"EMPANADA, MEXICAN TURNOVER, PUMPKIN","Empanada,  Mexican turnover, pumpkin"
53500100.00,"BREAKFAST PASTRY, NFS","Breakfast pastry, NFS"
53510000.00,"DANISH PASTRY, PLAIN/SPICE (INCL W/ ICING)","Danish pastry, plain or spice"
53510100.00,"DANISH PASTRY, W/ FRUIT","Danish pastry, with fruit"
53510200.00,"DANISH PASTRY, W/ NUTS","Danish pastry, with nuts"
53511000.00,"DANISH PASTRY, W/ CHEESE","Danish pastry, with cheese"
53511500.00,"DANISH PASTRY, W/ CHEESE, FAT FREE, NO CHOL","Danish pastry, with cheese, fat free, cholesterol free"
53520000.00,"DOUGHNUT, NS AS TO CAKE OR YEAST","Doughnut, NS as to cake or yeast"
53520110.00,"DOUGHNUT, CAKE TYPE","Doughnut, cake type"
53520120.00,"DOUGHNUT, CHOCOLATE, CAKE TYPE","Doughnut, chocolate, cake type"
53520140.00,"DOUGHNUT, CAKE TYPE, CHOCOLATE COVERED","Doughnut, cake type, chocolate covered"
53520150.00,"DOUGHNUT, CAKE TYPE, CHOCOLATE COVERED, W/ PEANUTS","Doughnut, cake type, chocolate covered, dipped in peanuts"
53520160.00,"DOUGHNUT, CHOCOLATE, CAKE TYPE, WITH CHOCOLATE ICING","Doughnut, chocolate, cake type, with chocolate icing"
53520200.00,"CHURROS (INCL MEXICAN CRUELLERS)","Churros"
53520500.00,"DOUGHNUT, ORIENTAL","Doughnut, oriental"
53520600.00,"CRULLER, NFS","Cruller, NFS"
53520700.00,"FRENCH CRULLER","French cruller"
53521100.00,"DOUGHNUT, CHOCOLATE, RAISED OR YEAST, WITH CHOCOLATE ICING","Doughnut, chocolate, raised or yeast, with chocolate icing"
53521110.00,"DOUGHNUT, RAISED / YEAST","Doughnut, raised or yeast"
53521120.00,"DOUGHNUT, CHOCOLATE, RAISED OR YEAST","Doughnut, chocolate, raised or yeast"
53521130.00,"DOUGHNUT, RAISED OR YEAST, CHOCOLATE COVERED","Doughnut, raised or yeast, chocolate covered"
53521140.00,"DOUGHNUT, JELLY","Doughnut, jelly"
53521210.00,"DOUGHNUT, CUSTARD-FILLED","Doughnut, custard-filled"
53521220.00,"DOUGHNUT, CHOCOLATE CREAM-FILLED","Doughnut, chocolate cream-filled"
53521230.00,"DOUGHNUT, CUSTARD-FILLED, WITH ICING","Doughnut, custard-filled, with icing"
53521250.00,"DOUGHNUT, WHEAT","Doughnut, wheat"
53521300.00,"DOUGHNUT, WHEAT, CHOCOLATE COVERED","Doughnut, wheat, chocolate covered"
53530000.00,"BREAKFAST TART","Breakfast tart"
53530010.00,"BREAKFAST TART, LOWFAT","Breakfast tart, lowfat"
53540000.00,"BREAKFAST BAR, NFS","Breakfast bar, NFS"
53540100.00,"BREAKFAST BAR, CAKE-LIKE","Breakfast bar, cake-like"
53540200.00,"BREAKFAST BAR, CEREAL CRUST W/ FRUIT FILLING, LOWFAT","Breakfast bar, cereal crust with fruit filling, lowfat"
53540250.00,"BREAKFAST BAR, CEREAL CRUST W/ FRUIT FILLING, FAT FREE","Breakfast bar, cereal crust with fruit filling, fat free"
53540300.00,"FIBER ONE CHEWY BAR","Fiber One Chewy Bar"
53540400.00,"KELLOGG'S NUTRI-GRAIN CEREAL BAR","Kellogg's Nutri-Grain Cereal Bar"
53540402.00,"KELLOGG'S NUTRI-GRAIN YOGURT BAR","Kellogg's Nutri-Grain Yogurt Bar"
53540404.00,"KELLOGG'S NUTRI-GRAIN FRUIT AND NUT BAR","Kellogg's Nutri-Grain Fruit and Nut Bar"
53540500.00,"BREAKFAST BAR, DATE, W/ YOGURT COATING","Breakfast bar, date, with yogurt coating"
53540600.00,"MILK 'N CEREAL BAR","Milk 'n Cereal bar"
53540700.00,"KELLOGG'S SPECIAL K BAR","Kellogg's Special K bar"
53540800.00,"KASHI GOLEAN CHEWY BARS","Kashi GOLEAN Chewy Bars"
53540802.00,"KASHI TLC CHEWY GRANOLA BAR","Kashi TLC Chewy Granola Bar"
53540804.00,"KASHI GOLEAN CRUNCHY BARS","Kashi GOLEAN Crunchy Bars"
53541100.00,"BREAKFAST BAR, DIET MEAL TYPE","Breakfast bar, diet meal type"
53541200.00,"MEAL REPLACEMENT BAR","Meal replacement bar"
53542000.00,"SNACK BAR, OATMEAL","Snack bar, oatmeal"
53542100.00,"GRANOLA BAR W/ OATS, SUGAR, RAISINS, COCONUT","Granola bar, oats, sugar, raisins, coconut"
53542200.00,"GRANOLA BAR, OATS, FRUIT, NUTS, LOWFAT","Granola bar, oats, fruit and nuts, lowfat"
53542210.00,"GRANOLA BAR, NONFAT","Granola bar, nonfat"
53543000.00,"GRANOLA BAR, OATS, REDUCED SUGAR","Granola bar, oats, reduced sugar"
53543100.00,"GRANOLA BAR W/ PEANUTS, OATS, SUGAR, WHEAT GERM","Granola bar, peanuts, oats, sugar, wheat germ"
53544200.00,"GRANOLA BAR, CHOCOLATE-COATED, NFS","Granola bar, chocolate-coated, NFS"
53544210.00,"GRANOLA BAR, W/ COCONUT, CHOCOLATE-COATED","Granola bar, with coconut, chocolate-coated"
53544220.00,"GRANOLA BAR W/ NUTS, CHOCOLATE-COATED","Granola bar with nuts, chocolate-coated"
53544230.00,"GRANOLA BAR, OATS, NUTS, COATED WITH NON-CHOCOLATE COATING","Granola bar, oats, nuts, coated with non-chocolate coating"
53544250.00,"GRANOLA BAR, COATED W/ NONCHOCOLATE COATING","Granola bar, coated with non-chocolate coating"
53544300.00,"GRANOLA BAR, HIGH FIBER, YOGURT COATING, NOT CHOC","Granola bar, high fiber, coated with non-chocolate yogurt coating"
53544400.00,"GRANOLA BARS, W/ RICE CEREAL","Granola bar, with rice cereal"
53544410.00,"QUAKER GRANOLA BITES","Quaker Granola Bites"
53544450.00,"POWERBAR (FORTIFIED HIGH ENERGY BAR)","PowerBar (fortified high energy bar)"
53610000.00,"COFFEE CAKE, NFS","Coffee cake, NFS"
53610100.00,"COFFEE CAKE, CRUMB OR QUICK-BREAD TYPE","Coffee cake, crumb or quick-bread type"
53610120.00,"COFFEE CAKE,CRUMB/QUICK BREAD TYPE,RED FAT,NO CHOL","Coffee cake, crumb or quick-bread type, reduced fat, cholesterol free"
53610150.00,"COFFEE CAKE, CRUMB / QUICK BREAD TYPE W/ ICING","Coffee cake, crumb or quick-bread type, with icing"
53610170.00,"COFFEE CAKE, CRUMB OR QUICK-BREAD TYPE, W/ FRUIT","Coffee cake, crumb or quick-bread type, with fruit"
53610200.00,"COFFEECAKE, CRUMB OR QUICK-BREAD TYPE, CHEESE FILLD","Coffee cake, crumb or quick-bread type, cheese-filled"
53610250.00,"COFFEE CAKE, QUICK-BREAD TYPE, CUSTARD FILLED","Coffee cake, crumb or quick-bread type, custard filled"
53801000.00,"CEREAL BAR WITH FRUIT FILLING, BABY FOOD","Cereal bar with fruit filling, baby food"
54001000.00,"CRACKER, NS AS TO SWEET/NONSWEET (INCL CRACKER,NFS)","Crackers, NS as to sweet or nonsweet"
54101010.00,"CRACKER, ANIMAL (INCL ARROWROOT COOKIE)","Cracker, animal"
54102010.00,"CRACKERS, GRAHAM","Crackers, graham"
54102020.00,"CRACKERS, GRAHAM, CHOCOLATE COVERED","Crackers, graham, chocolate covered"
54102030.00,"CRACKERS, GRAHAM, SUGAR-HONEY COATED, CINNAMON CRIS","Cracker, graham, sugar-honey coated, cinnamon crisps"
54102050.00,"CRACKERS, OATMEAL","Crackers, oatmeal"
54102060.00,"CRACKERS, CUBAN","Crackers, Cuban"
54102090.00,"CRACKER, GRAHAM, HIGHER FAT","Crackers, graham, higher fat"
54102100.00,"CRACKERS, GRAHAM, LOWFAT","Crackers, graham, lowfat"
54102110.00,"CRACKERS, GRAHAM, FAT FREE","Crackers, graham, fat free"
54102200.00,"CRACKERS, GRAHAM, SANDWICH-TYPE, WITH FILLING","Crackers, graham, sandwich-type, with filling"
54201010.00,"CRACKERS, MATZO, LOW SODIUM","Crackers, matzo, low sodium"
54202010.00,"CRACKERS, SALTINE, LOW SODIUM","Crackers, saltine, low sodium"
54202050.00,"CRACKERS, SALTINE, FAT FREE, LOW SODIUM","Crackers, saltine, fat free, low sodium"
54203010.00,"CRACKERS, TOAST THINS (RYE/WHEAT/WHITE), LOW SODIUM","Crackers, toast thins (rye, wheat, white flour), low sodium"
54204010.00,"CRACKER, 100% WHOLE WHEAT,LO SODIUM","Cracker, 100% whole wheat, low sodium"
54205010.00,"CRACKER, SNACK, LOW SODIUM","Cracker, snack, low sodium"
54205030.00,"CRACKER, CHEESE, LOW SODIUM","Cracker, cheese, low sodium"
54205100.00,"CRACKER, SNACK, LOWFAT, LOW SODIUM","Cracker, snack, lowfat, low sodium"
54206010.00,"PUFFED RICE CAKE W/O SALT","Puffed rice cake without salt"
54210010.00,"CRACKER, MULTIGRAIN, SALT-FREE","Cracker, multigrain, salt free"
54301000.00,"CRACKER, SNACK","Cracker, snack"
54301100.00,"CRACKER, SNACK, REDUCED FAT","Cracker, snack, reduced fat"
54301200.00,"CRACKER, SNACK, FAT FREE","Cracker, snack, fat free"
54304000.00,"CRACKERS, CHEESE","Cracker, cheese"
54304100.00,"CRACKER, CHEESE, REDUCED FAT","Cracker, cheese, reduced fat"
54304500.00,"CRACKER, HIGH FIBER, NO ADDED FAT","Cracker, high fiber, no added fat"
54305000.00,"CRISPBREAD, WHEAT, NO ADDED FAT","Crispbread, wheat, no added fat"
54305500.00,"CRISPBREAD,WHEAT / RYE, EXTRA CRISPY","Crispbread, wheat or rye, extra crispy"
54307000.00,"CRACKERS, MATZO","Crackers, matzo"
54308000.00,"CRACKERS, MILK","Crackers, milk"
54309000.00,"CRACKERS, OAT BRAN (INCLUDE NABISCO OAT THINS)","Crackers, oat"
54313000.00,"CRACKERS, OYSTER","Crackers, oyster"
54318500.00,"RICE CAKE, CRACKER-TYPE","Rice cake, cracker-type"
54319000.00,"CRACKERS, RICE","Crackers, rice"
54319010.00,"PUFFED RICE CAKE","Puffed rice cake"
54319020.00,"POPCORN CAKE (INCL PUFFED CORN & RICE CAKE)","Popcorn cake"
54319050.00,"PUFFED CORN CAKE (INCL QUAKER)","Puffed corn cake"
54319500.00,"RICE PAPER","Rice paper"
54322000.00,"CRISPBREAD, RYE, NO ADDED FAT","Crispbread, rye, no added fat"
54325000.00,"CRACKERS, SALTINES","Crackers, saltine"
54325050.00,"CRACKERS, SALTINE, WHOLE WHEAT","Crackers, saltine, whole wheat"
54327950.00,"CRACKERS, CYLINDRICAL, PEANUT BUTTER-FILLED","Crackers, cylindrical, peanut-butter filled"
54328000.00,"CRACKER, SANDWICH-TYPE, NFS","Crackers, sandwich-type, NFS"
54328100.00,"CRACKER,SANDWICH-TYPE,PEANUT BUTTER FILLED","Cracker, sandwich-type, peanut butter filled"
54328110.00,"CRACKER, SANDWICH, PEANUT BUTTER FILLED, RED FAT","Cracker, sandwich-type, peanut butter filled, reduced fat"
54328200.00,"CRACKER,SANDWICH-TYPE, CHEESE-FILLED","Cracker, sandwich-type, cheese-filled"
54334000.00,"CRACKERS, TOAST THINS","Crackers, toast thins (rye, pumpernickel, white flour)"
54336000.00,"CRACKER, WATER BISCUIT","Crackers, water biscuits"
54337000.00,"CRACKER, 100% WHOLE WHEAT","Cracker, 100% whole wheat"
54337050.00,"CRACKER, 100% WHOLE WHEAT, REDUCED FAT","Cracker, 100% whole wheat, reduced fat"
54337100.00,"CRACKER,WHOLE WHEAT & BRAN (INCL WH & BRAN TRISCUIT","Crackers, whole wheat and bran"
54338000.00,"CRACKERS, WHEAT","Crackers, wheat"
54338100.00,"CRACKERS, WHEAT, REDUCED FAT","Crackers, wheat, reduced fat"
54350000.00,"CRACKERS, BABY FOOD","Crackers, baby food"
54350010.00,"GERBER FINGER FOODS, PUFFS, BABY FOOD","Gerber Finger Foods, Puffs, baby food"
54401010.00,"SALTY SNACKS, CORN / CORNMEAL BASE, NUT /NUG, TSTD","Salty snacks, corn or cornmeal base, nuts or nuggets, toasted"
54401020.00,"SALTY SNACKS, CORN OR CORNMEAL, CORN CHIPS, CHEESE","Salty snacks, corn or cornmeal base, corn chips, corn-cheese chips"
54401050.00,"SALTY SNACKS, CORN OR CORNMEAL, CORN PUFFS, TWISTS","Salty snacks, corn or cornmeal base, corn puffs and twists; corn-cheese puffs and twists"
54401080.00,"SALTY SNACKS, CORN OR CORNMEAL, TORTILLA CHIPS","Salty snacks, corn or cornmeal base, tortilla chips"
54401090.00,"SALTY SNACKS, CORN/CORN-CHEESE CHIPS, UNSALTED","Salty snacks, corn or cornmeal base, corn chips, corn-cheese chips, unsalted"
54401100.00,"SALTY SNACKS,CORN / CORNMEAL BASE,TORTILLA CHIPS LT","Salty snacks, corn or cornmeal base, tortilla chips, light (baked with less oil)"
54401120.00,"SALTY SNACKS, TORTILLA CHIPS, FAT FREE, W/ OLEAN","Salty snacks, corn or cornmeal base, tortilla chips, fat free, made with Olean"
54401150.00,"SALTY SNACKS,CORN/CORNMEAL BASE,TORTILLA,LOWFAT,BKD","Salty snacks, corn or cornmeal base, tortilla chips, lowfat, baked without fat"
54401170.00,"SALTY SNACKS,CORN/CORNMEAL,TORTILLA,LOWFAT,BKD,NO SALT","Salty snacks, corn or cornmeal base, tortilla chips, lowfat, baked without fat, unsalted"
54401210.00,"SALTY SNACKS, CORN BASED/CHEESE PUFFS & TWISTS, LOWFAT","Salty snacks, corn based puffs and twists, cheese puffs and twists, lowfat"
54402080.00,"TORTILLA CHIPS, UNSALTED","Salty snacks, corn or cornmeal base, tortilla chips, unsalted"
54402200.00,"SALTY SNACK MIXTURE,MOSTLY CORN,W/PRETZELS,W/O NUTS","Salty snack mixture, mostly corn or cornmeal based, with pretzels, without nuts"
54402500.00,"SALTY SNACKS, WHEAT-AND CORN-BASED CHIPS","Salty snacks, wheat- and corn-based chips"
54402600.00,"SALTY SNACKS, MULTIGRAIN CHIPS","Salty snacks, multigrain, chips"
54402700.00,"PITA CHIPS","Pita chips"
54403000.00,"POPCORN, POPPED IN OIL, UNBUTTERED","Popcorn, popped in oil, unbuttered"
54403010.00,"POPCORN, AIR-POPPED (NO BUTTER OR OIL ADDED)","Popcorn, air-popped (no butter or no oil added)"
54403020.00,"POPCORN, POPPED IN OIL, BUTTERED","Popcorn, popped in oil, buttered"
54403030.00,"POPCORN, W/ CHEESE","Popcorn, with cheese"
54403040.00,"POPCORN, AIR-POPPED, BUTTERED","Popcorn, air-popped, buttered"
54403050.00,"POPCORN, FLAVORED (CHEESE, BBQ, SOUR CREAM, ONION)","Popcorn, flavored"
54403060.00,"POPCORN, POPPED IN OIL, LOWFAT, LOW SODIUM","Popcorn, popped in oil, lowfat, low sodium"
54403070.00,"POPCORN, POPPED IN OIL, LOWFAT","Popcorn, popped in oil, lowfat"
54403090.00,"POPCORN, POPPED IN OIL, UNSALTED","Popcorn, popped in oil, unsalted"
54403110.00,"POPCORN, SUGAR SYRUP OR CARAMEL COATED","Popcorn, sugar syrup or caramel-coated"
54403120.00,"POPCORN, SUGAR SYRUP OR CARAMEL COATED, W/ NUTS","Popcorn, sugar syrup or caramel-coated, with nuts"
54403150.00,"POPCORN, SUGAR SYRUP/CARAMEL COATED, FAT FREE","Popcorn, sugar syrup or caramel-coated, fat free"
54406010.00,"SNACKS, ONION-FLAVORED RINGS","Snacks, onion-flavored rings"
54406200.00,"SHRIMP CHIPS","Shrimp chips (tapioca base)"
54408000.00,"PRETZELS, NFS","Pretzels, NFS"
54408010.00,"PRETZELS, HARD","Pretzels, hard"
54408020.00,"PRETZELS, SOFT","Pretzels, soft"
54408030.00,"PRETZELS, HARD, UNSALTED","Pretzel, hard, unsalted"
54408040.00,"PRETZELS, SOFT, UNSALTED","Pretzels, soft, unsalted"
54408050.00,"PRETZEL, OAT BRAN, HARD","Pretzel, oatbran, hard"
54408070.00,"PRETZEL, HARD, MULTIGRAIN","Pretzel, hard, multigrain"
54408100.00,"PRETZEL, BABY FOOD","Pretzel, baby food"
54408200.00,"PRETZEL, HARD, CHOCOLATE COATED","Pretzel, hard, chocolate-coated"
54408250.00,"PRETZEL, YOGURT COVERED","Pretzel, yogurt-covered"
54408300.00,"PRETZELS, CHEESE-FILLED (INCL COMBOS)","Pretzels, cheese-filled"
54420010.00,"MULTIGRAIN MIXTURE, PRETZELS, CEREAL &/ CRACKERS,NUTS","Multigrain mixture, pretzels, cereal and/or crackers, nuts"
54420100.00,"ORIENTAL PARTY MIX, W/ PEANUTS, SESAME STICKS, ETC","Oriental party mix, with peanuts, sesame sticks, chili rice crackers and fried green peas"
54420200.00,"MULTIGRAIN MIX, BREAD STICKS, SESAME NUGGETS, PRETZ","Multigrain mixture, bread sticks, sesame nuggets, pretzels, rye chips"
54430010.00,"YOGURT CHIPS","Yogurt chips"
54440010.00,"BAGEL CHIP","Bagel chip"
55101000.00,"PANCAKES, PLAIN (INCLUDE PANCAKES, NFS)","Pancakes, plain"
55101010.00,"PANCAKES, REDUCED CALORIE, HIGH FIBER","Pancakes, reduced calorie, high fiber"
55101020.00,"PANCAKES, PLAIN, FAT FREE","Pancakes, plain, fat free"
55103000.00,"PANCAKES, W/ FRUIT (INCLUDE BLUEBERRY PANCAKES)","Pancakes, with fruit"
55103100.00,"PANCAKES W/ CHOC CHIPS","Pancakes, with chocolate chips"
55105000.00,"PANCAKES, BUCKWHEAT","Pancakes, buckwheat"
55105100.00,"PANCAKES, CORNMEAL","Pancakes, cornmeal"
55105200.00,"PANCAKES, WHOLE WHEAT","Pancakes, whole wheat"
55105300.00,"PANCAKES, SOURDOUGH","Pancakes, sour dough"
55105400.00,"PANCAKES, RYE","Pancakes, rye"
55201000.00,"WAFFLE, PLAIN","Waffle, plain"
55202000.00,"WAFFLE, WHEAT, BRAN, OR MULTIGRAIN","Waffle, wheat, bran, or multigrain"
55203000.00,"WAFFLE, FRUIT","Waffle, fruit"
55203500.00,"WAFFLE, NUT & HONEY (INCL EGGO)","Waffle, nut and honey"
55203600.00,"WAFFLE, CHOCOLATE CHIP","Waffle, chocolate chip"
55204000.00,"WAFFLE, CORNMEAL","Waffle, cornmeal"
55205000.00,"WAFFLE, 100% WHOLE WHEAT OR 100% WHOLE GRAIN","Waffle, 100% whole wheat or 100% whole grain"
